title,sentimentNLTK,sentimentBlob
"Good news, my Phaerons, I have divined that these lesser species will eventually give up and leave us alone!",0.4199,0.35
Artwork by Ito (daisukidanchi),0.0,0.0
Are you FF me!,0.5893,0.0
The shadow government doesn't want you to know this but the induce boogie spell is just a more mana efficient spell interupt,0.6132,0.5
Have any of you seen this?,0.0,0.0
Which nation has the hottest daddy?,0.0,0.0
Down to love & cook,0.6369,0.17222222222222222
"[Request] If this was a real human, what are the chances of him surviving and what injuries would he sustain(Average height and weight male)?",0.4588,0.0
Tom Aspinall rinses Ciryl Gane over him wanting to fight him next. Breaks down why he doesn't deserve it.,-0.3818,-0.07777777777777779
Name Suggestions?,0.0,0.0
Shadow people with glowing eyes,0.0,0.0
>:3,0.0,0.0
I'm not crying you are,0.3724,0.1
OldLady Lucy (15) annual vet appointment! She had a rave review from the doctor!!! 🤘🏼🥰🤘🏼,0.0,0.0
we do a lil armored heisty tomfoolery,0.0,0.0
Ruger is back and wondering about puppy food?,0.0,0.0
Sign me up,0.0,0.0
Ari’s man is so 😍🥵🤭,0.0,0.0
Painfull truth,0.3182,0.0
"Thanks, I hate Brian as Bluey",-0.2023,-0.30000000000000004
Emily,0.0,0.0
"Random question, but have any of you changed your public apperance to be more feminine?",0.0,0.0
One second before disaster.,-0.6249,0.0
Cute Children’s Play,0.6597,0.5
Jerma is twilight confirmed!? (real) (not klickbait),0.0,0.35
Donald Trump's Interactions With Secret Service on Jan. 6 Revealed in Audio,0.0,-0.4
Meds tampered with?!?,0.0,0.0
(21f) Hiya! Been a while,0.0,0.0
God what a sad life they live,-0.25,-0.18181818181818182
sir bhi dank ho rhe h,0.0,0.0
"No advertisers? No problem. In his infinite genius, he doubles down against advertisers",-0.7269,-0.15555555555555559
So called Gen-Z ,0.0,0.0
"""You guys gotta be kidding me."" - Uzi Fanart!",0.1759,0.0
Pretend the comment section is RuPaul’s search history,-0.1027,0.0
André 3000 talks about his new album and life after Outkast at a laundromat.,0.0,0.13636363636363635
"This one's for all you beautiful, wonderful Neurodivergent people",0.8225,0.925
Krusty Krab,0.0,0.0
The Eevee Tera Raid Event has reminded me again how funny Gamefreak is,0.4404,0.25
My opinion is unpopular within my social circle but I stand with Israel,0.0,0.03333333333333333
"The wealthy have the power to terrorize and trap people, while almost always getting away with it.",-0.6249,0.5
A cool guide to Marvel's box office numbers,0.3182,0.35
anime_irl,0.0,0.0
Lego movie will turn 10 next year,0.0,0.0
I need names! (Female) I'm adopting her tomorrow!,0.0,0.0
I know people are tired of this kind of posts but… I finally have a PS5 after 3 years!!!!!,-0.6209,0.06666666666666665
Cookie Monster,0.0,0.0
Time traveler: moves chair,0.0,0.0
Waffle House,0.0,0.0
It's real,0.0,0.2
1977 Lynda Carter,0.0,0.0
The lack of discourse on this new series is astounding (if not at all surprising),0.128,0.47878787878787876
"Bro, it was smooth ",0.0,0.4
THE AURUMATON TRANSITIONED!!! 🏳️‍⚧️🔥✍️,0.0,0.0
Can someone explain this flag to me? The background is white with blue stars.,0.0,0.0
Even the Bird Got The vibes,0.0,0.0
Average r/BocchiTheRock user or idk how to name it (THIS IS LITERALLY ME ASF FR FR),-0.1027,-0.15
"Begged my husband for another cat for years, got one from a shter, and then he begged for another kitty he fell in love with...",0.6369,0.5
Yep,0.296,0.0
My mother with the famous Roy Rogers on his horse Trigger in 1951,0.0,0.5
Sivaji the boss,0.0,0.0
"If there was a fight, who will win?",0.296,0.8
Texas baby left in running bath for 15 minutes while parents take video call,0.0,0.0
Do you use ups or anything extra to protect your PC?,0.3818,0.0
231117 Jennie @ Tamburins Flagship Store Opening Event in Seoul,0.1027,0.0
"Put on a banger boys but remember, don’t work yourself into a shoot. Marks.",-0.4767,0.0
Humiliation Hits Home,-0.5719,0.0
Local home tattoo artist,0.0,0.0
My touché queen strikes again,-0.3612,0.0
"Side by side of my two berserk paintings, really proud of how these turned out :)",0.7501,0.65
"This 19-year-old Madam just woke up from her successful cancer surgery!! Mia might be high as a kite, but also cancer-free!",-0.4168,0.6
Someone else can deal with that.,0.0,0.0
Holiday legos are up,0.4019,0.0
Karen Allen,0.0,0.0
Card my 10-year-old daughter made for my brothers 35th birthday lmao,0.5994,0.6
Todays numbers. Only sharing to show how bad The Marvels drop was.,0.0516,-0.3499999999999999
The accuracy.... ,0.0,0.0
Neighbour's cat likes me a lot,0.4215,0.0
231117 Meet MEGAN of KATSEYE,0.0,0.0
Made a fake account,-0.4767,-0.5
"It's so frustrating that straight people have started to use ""pillow princess"" as an insult",-0.6519,-0.1
fixedIt,0.0,0.0
Caffeine Cat,0.0,0.0
Coby waiting for daddy to walk out of Walgreens,0.0,0.0
This was GOLD 🤣👏🏼,0.0,0.0
"Sanders Doubles Down Against Gaza Ceasefire in the Face of Progressive Backlash | The senator is calling for conditioning U.S. military aid, an end to “indiscriminate bombing” and a humanitarian pause.",0.0,-0.1277777777777778
The correct way to treat your bf's booty [Animation by @weirdhelga],0.4019,0.0
work convos,0.0,0.0
How essential oils pulled off the biggest rebrand of all time,0.0,0.0
3d printed handbrake for sim racing *update*,0.0,0.0
Happy Saturday morning from our cattos! 🐈,0.6114,1.0
"Here, take this",0.0,0.0
The virgin Fate zero's saber vs The chad Fate stay night's Saber.,0.0,0.0
Dakota Johnson in Gucci at Vanity Fair Oscar After Party 2022,0.4767,0.7
How many of you hate alcohol?,-0.5719,-0.15000000000000002
that’s not really how genetics work but ok,0.4215,0.2
cats are heat powered,0.0,0.0
PSA: Etsy is no longer a good platform to buy and sell plants,0.1779,0.7
When the ego gets bruised during sparring,0.0,0.0
Cursed_Homies,0.0,0.0
I beat cancer and turn 11 today,-0.6597,0.0
Stormy is 2.5 years old now and her and sister get all the viddles. Tonight they had some mcnugget. Those eyes!,0.0,0.125
"If these two characters were to interact, what would it be like?",0.3612,0.0
Nostalgie: Ich habe ein antikes MediaMarkt-Prospekt gefunden,0.0,0.0
"Three of our unit staff (Psychiatrist, Nurse Manager, and a Tech) just died immediately after retiring.",-0.5574,0.0
"JB haters go back into hiding, nobody ever wanna give him his flowers when he pulls through for us",-0.6597,0.0
My son 16 year old thinks I’m a killer,-0.6486,0.1
Grab your ankles!,0.0,0.0
Karen in tights x3,0.0,0.0
After 5 years of piracy and with 2.2 being around the corner I decided to buy geometry dash legally,0.1027,0.2
Saving a drowning sea turtle,0.0,0.0
Ball wunk,0.0,0.0
The child asked with wonder what the man from the future was here to do.,0.0,0.0
Wydowna’s attic update🕸️,0.0,0.0
Hmmm yea idk,-0.1027,0.0
"Stay away, human! Ok, that's not to bad..",0.3595,-0.06666666666666661
They are building a money fort,0.0,0.0
[jamesff] sentinels are practicing for afreeca cup without pancada,0.0,0.0
"""Mahoraga please save me""",0.6705,0.0
Daily wholesome delivery 3 Kinger is best dad! Made by (cheatsykoopa98) on Tumblr.,0.6696,0.5
I can stop thinking about Ryuko,-0.296,0.0
Happy birthday to the twins!! Already a year old 🥲,0.6467,0.55
Professor Doggo is always right,0.0,0.2857142857142857
"Paladin, by me",0.0,0.0
We got my mom a pijama set of our dog,0.0,0.0
What watching Poland vs Czechia feels like,0.3612,0.0
"This is how my gf likes her steak. When we first met, she like them well done.",0.7506,0.25
Hehe..,0.0,0.0
Red-handed,0.0,0.0
The solution to Azerite Snake? Just get 20 Max Health per turn,0.3182,0.0
I got a request to make a memorial piece for this cutie who used to suckle on her little blue blanket and get stray threads stuck on her mouth. Then I had the idea to attach a loose thread in there to make it extra unique! 💙,-0.182,0.040865384615384616
How about my setup?,0.0,0.0
A circle of little points!,0.0,-0.234375
Results of my survey,0.0,0.0
"Meet Vera. Despite her age, this girl fully goes under fire, in all positions at the front, reflashing the guys’ walkie-talkies. She goes, as male comms officers are very busy. Vera is happy her AKS-74U got swapped for AK-74. The AK-74 is 3/4 of her height.",0.2585,0.31
Fashion Highlight: Cornrows,0.34,0.0
True Romance,0.7506,0.35
Two incidents already this week,0.0,0.0
Can't believe this was 5 years ago today,0.0,0.0
I thought my gender change would be the highlight of the month but so much has happened! gf and I are getting a house and I also got snipped,0.2481,0.25
"[BRAVES] The #Braves today declined to tender contracts to LHP Kolby Allard, RHP Yonny Chirinos, RHP Penn Murfee, LHP Angel Perdomo, RHP Michael Tonkin, C Chadwick Tromp and INF Lucas Williams for the 2024 season. Atlanta now has 30 players on the 40-man roster.",0.0,0.0
Texas House votes 84-63 to approve John Raney’s amendment stripping vouchers-like plan from HB1,0.0,0.0
Having a family is soooo different.,0.0,0.0
Keeping everyone stupid,-0.5267,-0.7999999999999999
Meirl,0.0,0.0
"This Is Biden’s Soft Landing, and He Deserves Some Credit",0.3818,0.1
Bi🗡irl,0.0,0.0
So pretty!! 💝,0.6221,0.390625
Community notes destroying another transphobe,-0.5574,-0.2
Xhamster anime adaptation.,0.0,0.0
7th anniversary by (@nishikujic),0.0,0.0
Ukraine expresses profound gratitude to the United States for the supply of the M2Bradley,0.7269,0.08333333333333333
Unreal,0.0,0.0
"Seasons Greetings, cunt.",-0.1027,0.0
"Is there a lore reason why people call the Blood Rose Prince, the Sombre Paladin, the Lord of Masques, the First Exemplar, Sumeros Summerking, Ushoran the Bold, the finest blade of the Mortarchs; a ""horrible, cannibalistic monster""? Are they stupid?",-0.2869,-0.12333333333333332
To all truckas becareful where you park your rig.  This happen to me before. ,-0.128,0.0
Shes dumb,-0.5106,-0.375
I guess Burr won't be on the show any time soon,0.0,0.0
"An Australian dancer talks about the time Ye protected her from sexual harassment on set. 
",-0.1531,0.25
DNC Document Shows Party Is Authorized To Swap Out Presidential Candidate After Receiving the Nomination,0.4019,0.0
Why play marcel when you cam have romo do nothing for 60 minutes?,0.34,0.0
Is putting access hatches back wrong a tradition for UK workmen?,-0.4767,-0.25
"He's been sitting there for hours, I don't own a cat, what is he doing?",0.0,0.6
New Flesh Eater Court Army Set,0.0,0.13636363636363635
"Humans have the bizarre ability to make aliens extremely possessive of them, most humans are completely unaware of this and just assume that aliens are just friendly.",-0.0222,0.22999999999999998
[Niners Nation] Brock Purdy is statistically the best deep thrower in the NFL,0.6369,0.5
Lesbian,0.0,0.0
"Truly a game of all times, it does have graphics and quests",0.4404,-0.4
Running along a beach in ASA and this strange Raptor is in your way. What do you do?,-0.25,-0.05
Human's are Teachers,0.0,0.0
"A real sad one,Dominique Dunne seen in her final television role before she was killed by her ex boyfriend.",-0.8225,-0.31666666666666665
the best cuddling positions,0.6369,1.0
"The breeder told me she may or may not turn out to be a sesame as she grows up. What do you think? She's 3 months old. I don't mind either way, just curious.",0.3182,0.0
Replacing NZ culture with American,0.0,0.0
"This is the highest HP I've seen so far, is it only exclusive to HuoHuo or Fu Xuan can reach it as well?",-0.4588,0.05
This bee burns better. Look!,0.4926,0.625
A flawless plan,0.5106,1.0
I see all of you,0.0,0.0
"Soaring train fares, shrinking sleeper coaches add to passenger woes",-0.4404,0.0
Night Trying,0.0,0.0
"DC's Red Hood, for some reason I always really liked that one design trope where the character has a really technologically advanced exosuit or armor but wears a coat or a jacket over it, so that's what i based this redesign on",0.3991,0.30000000000000004
😭😭😭,0.0,0.0
TIFU by not recognizing the signs of a woman hitting on me,0.0,0.0
Should this people be considered human?,0.0,0.0
"""Don't go to the rival sub."" *Proceeds to make this sub less fun*",0.0,0.06666666666666667
"Oakland Mayor responds to MLB approving A’s relocation to Las Vegas: ""a long way to go before there shovels in the ground in Vegas. I’m going to keep working to hold MLB, team owners accountable for prioritizing their pockets over communities that supported them. Baseball belongs in the East Bay""",0.3182,-0.05
NASA and Japan to launch world's 1st wooden satellite as soon as 2024. Why?,0.0,0.0
Get to the important shit already,-0.4215,0.1
My new little baby Willow,0.0,-0.025568181818181823
I have a bad feeling about this,-0.4588,-0.6999999999999998
Weird book covers on bundle haul,-0.1779,-0.5
[CHAT] I feel like an idiot,-0.2023,-0.8
Gungnir,0.0,0.0
Casual Hu Tao (by: Myless),0.2023,-0.5000000000000001
luxury dog,0.0,0.0
I’m at a loss for words.,-0.3182,0.0
99% of Hungarians can't name this country,0.0,0.0
street shower,0.0,0.0
Are dilute torties allowed here?,0.0,0.0
People don't take marriage seriously enough,0.1326,0.0
My pumpkin plant captured an insect that normally feeds on it,0.0,0.15
Sasha Banks launched as a weapon,-0.1779,0.0
My 15 year old Princess Curly,0.0,0.1
This is why you hire the expensive graphic designer,0.0,-0.25
Acentos de Mexico,0.0,0.0
shooting incident,0.0,0.0
"You can make up details and quotes from the Madame Web (2024) movie and no one will be able to disprove them, that's because no one is gonna watch the movie.",-0.5267,0.5
Drew Ymir if she had eaten (had a little nibble of) the Armored Titan instead of the Jaw,0.0,-0.1875
So close to my goal 10k🚀🚀,0.0,0.0
Any form of religious fundamentalism can lead to violence!,-0.6588,0.0
"Not Even Lying, Ness Was My Favorite Character",0.6981,0.5
I was given empty Chick-fil-A gift cards for teacher appreciation,0.6597,-0.1
IGN [COD] Ranking,0.0,0.0
What a Q-tip gonna do?,0.0,0.0
Have I DRS’d properly? I called to switch to book shares a while back and figured I’d double check I’m booked and good to go,0.6249,0.175
"Seasonal reminder: If you’re sick, stay home. Please.",-0.25,-0.7142857142857143
What is the legality of creating a sentry turret in Mississippi?,0.296,0.0
Forgive me if i just come off as ignorant but are these building spelling something out in Kanji?,0.0,0.0
Nov 17th sunset from Columbia Center,0.0,-0.1
Am I right?,0.0,0.2857142857142857
rule,0.0,0.0
My step children don’t listed to me,0.0,0.0
ITAP of the Apostle Islands in Wisconsin,0.0,0.0
I’m so disgusted right now ,-0.5709,-0.35714285714285715
"More student loan borrowers are walking away from their debt in bankruptcy, Biden administration says",-0.3612,0.5
TheDonald users getting extremely angry about a black women *checks notes* fixing a car,-0.5563,-0.3333333333333333
"A constant work in progress but, I’m really enjoying our living room",0.7869,0.25
Stupid sexy Bryan,0.0,-0.14999999999999997
This is so true,0.5598,0.35
"It's cringe or be cringe, Jack!",0.0,0.0
Which character in film had the most bleak final scene or end to their arc?,0.0,-0.16666666666666666
An accurate depiction of what Ordis does when he's not with the player...,0.0,0.4000000000000001
Did anyone ever notice this?,0.0,0.0
Efficiency man returns.,0.3612,0.0
"[oc] Old lady going the wrong way, throws hands in the air.",-0.4767,-0.2
egg🙅‍♀️irl,0.0,0.0
Why isnt the Monk used more if it's supposed to hard counter all of the current metas as well as destroy midladder ranged cards?,-0.4215,0.002083333333333326
[Smackdown Spoilers] Finish to Dragon Lee vs ??? match,0.0,0.0
"Sculpture of a seated warrior with two dogs. Veracruz, Mexico, 400-800 AD [2850x2088]",0.0,0.0
"Upcoming QBs: Russ, Fields, AOC, Jake Browning, Goff, Love, Goff",0.6369,0.5
How To Obtain EVERYTHING In The Awakened King,0.0,0.0
Not voting for Biden means Trump wins.,0.5719,0.3
"FS, please color friendly flames differently",0.6705,0.1875
he is observing,0.0,0.0
How is this fair,0.3869,0.7
"Which bikeway infrastructure do you like the best, and why?",0.7717,1.0
January 6 Insurrection: Newly Released Footage Shows Insurrectionist Uncuffed and Fist-Bumping Capitol Police Officer,0.0,0.13636363636363635
Fighters can’t have sponsors on their shorts because it “looks unprofessional” but historic moments in the cage have this dumb af monster can as the backdrop,-0.7516,-0.1875
Georgia prosecutors ask judge to jail election subversion defendant over ‘effort to intimidate’ witnesses,0.0,-0.1
18F Would you date me if I asked you gently?,0.4588,0.2
Letter To My Younger Self: Thiago Silva,0.0,0.0
My deductible is $1000. Should I file a claim and eat the rate increase or do y'all think repairs will be less than that and I should put her back together out of pocket?,0.3182,-0.08333333333333333
"3 months ago I lost my Boston, Guillermo and last week my other Boston, Fiona, crossed the rainbow bridge. Goodbye, good pups. I’ll miss you always.",-0.0,0.19166666666666665
231118 Stray Kids Tiktok Update,0.0,0.0
Clarke. What is she?,0.0,0.0
Facts,0.0,0.0
"Tesco selling HIV test kits, buy 3 for 2 with a clubcard x",0.0,0.0
"Enjoying Monarch: Legacy of Monsters, But dreading this criticism returning. It’s like it is 2014 again",-0.692,0.5
"Jorginho has missed his last four penalties for Italy, including shoot-outs, but Luciano Spalletti ‘already told him that he will take the next spot-kick and he agreed.’",-0.1531,0.0
What the cat doing,0.0,0.0
furry🙍🏽irl,0.0,0.0
ihaveihave ihave: spent far too long on this brainrot,0.0,-0.016666666666666666
How many of you were in foster care growing up? I was and it..,0.5994,0.5
[icethetics on Twitter] It does look like the Utah Jazz Instagram accidentally leaked the Seattle Kraken Winter Classic jersey. I’m guessing an unveiling was really intended for yesterday with various other tie-ins scheduled into the weekend. Someone forgot to make a call. Oops!,-0.3595,0.052604166666666674
#husky #dogs,0.0,0.0
Got my first ever crackle effect which also happened to be gold and the white crackle matches her spray paint!,0.0,0.125
Christians getting mad at upside-down crosses will never not be hilarious,-0.3114,-0.0625
Locking the food pantry so the teachers don't utilize it,0.0,0.0
Petition to add blue shoulders on to the white jerseys,0.0,0.0
Got turned around in a garage and ran into this [Porsche 911 GT3RS],0.0,0.0
England v. Malta - Rashford and Alexander-Arnold Collision,-0.3612,0.0
r/Fauxmoi post about Travis Kelce's problematic old tweets prompts media blitz about how wholesome and cute his old tweets are,0.0258,0.2333333333333333
"""If You Come, I'll Show You the Quarter Trick""",-0.0516,0.0
ℂ𝕒𝕣 :𝟛,0.0,0.0
"I love watching idiots argue over cats or dogs, when the obvious answer is “both”",0.4215,-0.10000000000000002
"My wife came home excited and said, “You’ve got to try this burger dog from 7/11!”…imma have to pass",0.4003,0.46875
Found a dress I like,0.3612,0.0
Cypher got a nerf,0.0,0.0
My Pittie passed away…he was my best friend…,0.6369,1.0
this is huge (from todays patch notes),0.3182,0.4000000000000001
Epic you can do better. You're fumbling in the final stretch.,0.4404,0.19999999999999998
hOw RaRe iS tHiS??!,0.0,0.375
These are the comments of a video of a woman burning a rainbow flag,0.0,0.0
NDP agree to help pass Liberal 'affordable housing and groceries' bill in exchange for amendments,0.6369,0.0
Starting a day with a selfie,0.0,0.0
hmmm,0.0,0.0
aaaand here’s another one..,0.0,0.0
"If they keep Margot as Harley, we now have our Poison Ivy",-0.5423,0.0
As a controller main I kinda love this update,0.6003,0.3333333333333333
Turahk vs Chainsaw Man by @DankoDeadZone (nsfw artist),0.0,0.0
Couldn't Miranda have been able to tell Shepard where TIM's base is?,0.0,-0.15000000000000002
My thoughts racing during episode 3 (OC),0.0,0.0
Summary of The First Shadow,0.0,0.25
"Moraine Lake, Banff, Canada [OC][3899x5848][IG @wagstaffmedia]",0.0,0.0
Happy 1st Anniversary to FIFTY FIFTY!,0.6114,1.0
"Israeli soldier films himself invading an elementary school, smashes certificate given to children and then writes theyre reclaiming Gaza on the chalkboard. The only thing these fascists are good at fighting are schools, hospitals and refugee camps",-0.1027,0.3333333333333333
Poor Brandon :(,-0.7184,-0.575
Collection Objection,0.0,0.0
Incredible Judy Alvarez Cosplay by @roguelin on X (Twitter),0.0,0.9
Leave it to the Romans to stick a god in an ass.,-0.3818,0.0
Useful fact discovered about the Hylian Shield!,0.4926,0.375
"The world's largest single-site solar farm just came online in the United Arab Emirates and it will power nearly 200,000 homes",0.4215,0.1
Boo caught me sleeping!,0.0,0.0
Disney Joins Advertisers In Pausing Spend On X Amid Reported Rise in Antisemitic Speech,0.0,0.0
When you literally have to walk home,0.0,0.0
Scp-999 take him away.,0.0,0.0
[Faber] Tom Willander scores his second goal of the NCAA season. 🚨,0.0,0.0
Genshin Impact ｜ Paimon's Paintings XXVIII Emojis Now Available!,0.0,0.5
People these days don’t respect the flag and I think it’s disgusting,-0.0772,-1.0
These 4 awful men wouldve had any LGBTQ+ person face the wall before they had a soldier pull the trigger. Trans people deserve rights while these 4 monsters dont,-0.4588,-1.0
Found on Instagram,0.0,0.0
The doxxing truck came to my college😐,0.0,0.0
The Whistleblower Memorial,0.0,0.0
Human teaches wolf pup how to howl!,0.0,0.0
Dragon's Dogma 2 release date is March 22 2024,0.0,0.0
It's time to choose,0.0,0.0
This is likely the extent of Jenelle and David’s homeschool curriculum,0.0,0.0
Honey is always happy after the park 😄,0.5719,0.8
Hasan responds to Destiny through liking,0.4019,0.0
"Who's the first artist you think of when you hear the words ""blues legend""? Any blues artist, any era.",0.0,0.25
There is no in between,-0.296,0.0
Philly realizing Andy Reid has never lost a KC-PHI matchup,0.2411,0.0
Totally affordable payment plan! I'll get right on that...,0.0,0.14285714285714285
Title,0.0,0.0
Long child found in Bay Area CA,0.0,-0.05
"Sylvinho, o injustiçado, comemorando a classificação para a euro com torcedores da Albânia ",0.0,0.0
Take off your pants and do the hot dog dance.,0.0,0.25
I just sneezed.,0.0,0.0
If only Jeff knew how common this would be in the future,0.0,-0.09999999999999999
Me irl,0.0,0.0
"A little late, but here was my Halloween wreath",0.0,-0.24375
"Benny Johnson: ""I've never seen a Republican be violent""",-0.5994,-0.8
Greg Brockman's statement,0.0,0.0
What the heck?,0.0,0.0
Quality Thug Shakin,0.0,0.0
What's the stupidest thing you've ever heard anyone say?,-0.5267,0.0
Hindi ko malilimutan ang pambabastos nito at pangbababoy sa mga kaaway ni Duterte. Reyna ng DDS. Never forget.,0.1695,0.0
Making Persian Saffron Rice (Tachin),0.0,0.0
"My wife just told me one of my best friends doesn't really care about me, because he invited me to his wedding",0.6657,0.6
Who's your favorite burst 1+2 combo and why is it Mighty Tools?,0.4588,0.45
Like A Yong,0.3612,0.0
Smart boi graduated puppy class!,0.4574,0.26785714285714285
i just noticed rule 7 is mispelled and now i can't unnotice it 😭,0.0,0.0
"Not trying to be hateful, just hopefully they'll revert these changes cuz honestly it was perfect before",0.7351,0.8
My wife cleans for a lady...This is her cat Watson,0.0,0.0
He's tripping,0.0,0.0
Why are the hair options for women so... crappy?,-0.5574,0.0
Judge Sarah B. Wallace: Oval Offices DO NOT COUNT!,0.0,0.0
Anaconda swimming by a boat in the Amazon,0.1779,0.0
TIT LE,0.0,0.0
A Toronto realtor says the rental market is 'unhinged' after someone lists the other half of a bed,0.0,-0.14583333333333331
Be careful of what you wish for,0.5106,-0.1
[Update] Surgery went well and we are doin good!,0.6476,0.875
Fuck…,0.0,0.0
Gotta love green breads,0.6369,0.15
I realized the fact that Movie Afton is basically a Scooby Doo villain.,-0.5574,0.0
"THIS kid can't stop eavesdropping on our neighbors. When they look at him, he turns his head like he isn't paying attention.",0.5248,0.0
Up until this month I had no idea just how anti semitic the west still is under the surface,-0.5423,0.0
"[ART][OC] Scale & Tale - ""Potions & PTSD""",0.0,0.0
"Wait, WHAT?",0.0,0.0
The Last of Us Part II Remastered new features,0.0,0.06818181818181818
Taylor telling the staff to bring water for fans in Rio,0.0,0.0
"His Defense Has Been Great, Take One And Sign It",0.6808,0.8
"Ukraine’s artillery supply declines as shells go to Israel. President Zelenskyy confirms that 155mm deliveries are drying up, even as Russia presses an assault in the east.",-0.5859,0.0
The casual kind,0.6369,0.04999999999999993
Did youtube disable the anti-adblocker? I swear I have not seen it in weeks.,-0.0516,0.0
Rewatching first season and I’m shocked how different Stanley looks,-0.3182,-0.15
he think this the WWE????,0.0,0.0
Going out tonight? Well don't forget to blow someone's mind with your sick dance moves.,-0.1366,-0.7142857142857143
New Titan Boss goes down quickly,0.0,0.10471380471380469
Love nourishes love,0.8555,0.5
Most microwaves go their entire lifetime without having all their buttons pushed.,0.0,0.25
Take it all!!,0.0,0.0
What happens if a court finds someone not guilty and the defendant immediately says they did it after hearing the verdict?,0.4464,0.25
Met a hard working boy at a toy store,-0.1027,-0.2916666666666667
"Overall, Windwalker has been the worst performing DPS specialization this entire expansion.",-0.6249,-0.3333333333333333
Katrina on her 💚 flag husband,0.0,0.0
Mike Johnson's campaign contributions from company tied to Russia,0.0,0.0
[RUMOR] TLOU P2 Remastered was a project for new hires at ND. Neil Druckman’s team is full steam ahead on an original game.,0.3182,0.11534090909090908
My Conspiracy,-0.5267,0.0
