title,sentimentNLTK,sentimentBlob
"[Post Game Thread] Florida defeats Florida State, 89-68",-0.3182,-0.4
Better pictures of the 512gb Glossy Steam Deck Oled along with comparisons to LCD Deck and Rog Ally.,0.4404,0.5
*Daydreams of being able to pick my partner up bridal style* ☁️😌 [OC],0.0,0.5
"""in her divine presence"" my focalors fanart I hope you like it!",0.8516,0.0
[Nightengale] Milwaukee Brewers non-tender starter Brandon Woodruff,0.0,0.0
losercity loona,0.0,0.0
Just watched the ep... You're telling me Megumi was really about to bring out this freak of nature to fight Todo 💀,-0.7162,0.2
Visited All State Parks Follow Up - 20 Shots to Show the Variety,0.0,0.0
School is boring for everyone.,-0.3182,-1.0
Nuclear bomb test,-0.4939,0.0
This was so polite,0.0,0.0
I know I know im the only one who wants it back.,0.0,0.06666666666666667
I need it pure. It's all I have.,0.0,0.21428571428571427
Jing Lius Panties,0.0,0.0
Cooper (10). Waits at the top of the stairs while you go down until he can hear if you are making food or not.,0.2023,0.17222222222222222
Pro video editor building his dream bike. [Source: Quek Shio],0.25,0.0
Ambush - Carl Michael,0.0,0.0
Scored this set as a reward during the current Lego insider weekend,0.5719,0.0
My sister knitted me a purse and I couldnt find it. Rigatoni is using it as his personal mat for laying in sun spots.,0.0,0.0
Going to work,0.0,0.0
"oh God, what have I created...",0.2732,0.0
I love when the shows throws in older episode references,0.6369,0.3333333333333333
"Need an expert, what does this mean?",0.0,-0.3125
What do you say to kids with questions about other kids' accommodations,0.0,-0.125
"NBA says Hornets' LaMelo Ball must cover 'LF' tattoo, cites policy",0.0,0.0
Homelessness in China ,0.0,0.0
Looks like Dav still hasn’t learned how to kiss…,0.3612,0.0
Customer states they must have gotten a defective fuel pump from the parts store,-0.4404,0.0
‘Trolls Band Together’ Gets an A CinemaScore,0.0,0.0
gurranq bonk: dog,0.0,0.0
Just showing off my new void. Sally is 6 weeks old and is my foster to adopt 😍,0.1779,0.11818181818181818
"Tonight Russia attacked multiple regions of Ukraine with 38 attack drones. 29 drones were successfully intercepted, reported the Air Force of the Armed Forces of Ukraine.",-0.4404,0.375
Source: me,0.0,0.0
[Warner Bros Fiasco] The one time Coyote won,0.5719,0.0
It was smart. Soon as that thing would have hit the plane things would have got alot more expensive.,0.4019,0.07142857142857144
I just came to know that Guinaifen swallowed Yanqing's sword...,0.0,0.0
Conor McGregor,0.0,0.0
Me irl,0.0,0.0
furry_irl,0.0,0.0
AITA for putting a “mentally ill” father in jail and “ripping” him away from his disabled child,0.0,-0.26666666666666666
"Black, like a doll’s eyes",0.3612,-0.16666666666666666
"🔥 Nothing screams ""nature"" quite like the powerful Waterfalls of Letchworth State Park",0.7747,0.3
Truth?,0.3182,0.0
"TIL that virtually all of the ice in the biosphere is known as Ice I. At higher pressures though, there are 19 known different phases of ice.",-0.3182,0.125
Easy. Get your ouija board and ask away.,0.4404,0.43333333333333335
Cassie Settles Lawsuit Accusing Sean Combs of Rape and Abuse,-0.91,0.0
"For context, my son and I have been playing kickball quite a bit here lately.",0.2023,-0.3
Workers on edge after thieves across the U.S. target delivery trucks,-0.5106,0.0
The mythical bathroom wunkus,0.0,0.0
Just imagine the horror figure giving you that good kush man,0.1531,0.7
"The Moscow Times, Noted For Its English Coverage Of Russia, Is Declared 'Foreign Agent'",0.0,-0.0625
"Ukraine’s artillery supply declines as shells go to Israel. President Zelenskyy confirms that 155mm deliveries are drying up, even as Russia presses an assault in the east.",-0.5859,0.0
"This is what i'm talking about when I say the hate she gets is crazy, like aren't they first day college freshmen??",-0.6072,-0.3833333333333333
anime irl,0.0,0.0
Battle of the century,-0.3818,0.0
Title,0.0,0.0
He has now started his deflection after getting called out,0.0,0.0
It should have ended like this for her!,0.4199,0.0
Ani-,0.0,0.0
How ya doinnn?,0.0,0.0
The best actors aren’t in movies,0.6369,1.0
Dua Lipa becomes first person to directly ask Tim Cook if Apple uses child labor to mine cobalt,0.0,0.175
Reality is flexible,0.2263,0.0
maybe maybe maybe,0.0,0.0
CJ with dat smoke😭😭,0.0,0.0
This guy wanted me to know just how disinterested he is in me,0.0,0.0
"My best friend and service dog, Sparty. One week gone. My heart is still broken",0.6486,0.3
[Luke Fox] Toronto Maple Leafs lead the NHL in bench minors with 6 too-many-men penalties.,0.0,0.0
We lost another one,-0.3182,0.0
Overwatch 2 moment,0.0,0.0
The Emily Paradox,-0.1027,0.0
It’s my birthday,0.0,0.0
Bert Kreischer insult,-0.5106,0.0
When Roddy Piper said the only one close to him on the mic is CM Punk,0.0,0.0
"The picture says enough, humanity shines through",0.0,0.0
Thala entering Narendra Modi stadium tomorrow.,0.0,0.0
My Dad is Dracula (and a Save Point),0.4939,0.0
Altman To Step Down as CEO at Open-AI,0.0,-0.15555555555555559
my dude running like shit his pants,-0.2732,-0.2
Disney's 'Wish' Review Thread,0.0,0.0
Is there a joke in there? Or is it just nonsense?,-0.2168,0.0
Housewife Guilty!,-0.4753,-0.625
Two of my favorite series in one glorious picture.,0.802,0.5
Donald Mustard seeing how Epic handles Fortnite after leaving. (he notices the Visitor is restricted),0.0,0.1
The happiest fall cat,0.6369,0.0
Everytime I see a random cutie,0.3612,-0.5
Idk why he was ousted but I saw a meme opportunity ,0.5423,0.0
Well this is dope,0.2732,0.0
me irl,0.0,0.0
"I heard you’re pretty strong, Khorne",0.7579,0.3416666666666667
Ay man lmao 😭,0.5994,0.6
Rule,0.0,0.0
Crab is defensive about the shadows..,0.0258,0.0
egg🏳️‍⚧️❓irl,0.0,0.0
Billboard in Louisiana calls Biden a devil worshipper,-0.5859,0.0
Please let me go back to my delusions,0.3182,0.0
hmmm,0.0,0.0
"""Guidance Ambassadors"" in Iran's metros waiting for women who don't cover their hair to harass them",-0.4939,0.0
I Cleared Escort the STRIDER Without Taking Damage,0.4639,0.0
Never look away in the middle of a brawl.,0.0,0.0
"I just found out that my sweet, goofy 7yo boy almost certainly has stage 1 kidney disease. I know he will have to be on prescription food, but the amount of info on the Internet on further treatment is overwhelming and largely grim. Has anyone else been through the same?",-0.5418,0.08061224489795918
"Behold, my unholy creation",0.2732,0.0
"What videogame scene made you say “wait, this is only… the BEGINNING?!”",0.0,0.0
Get yours today,0.0,0.0
"[homemade] steak, eggs and potatoes.",0.0,0.0
Grunkle Soldier,0.0,0.0
Why can some people stay effortlessly thin while others cannot and even endanger themselves eating?,0.0,-0.4
[Highlight] Khris Middleton with eyes in the back of his head for the assist of the year!,0.0,0.0
"Haystack Rock, Cannon Beach, Oregon [OC] [6048x4024]",0.0,0.0
"Humans are some of the most, and least observant species out there",0.0,0.1
they done hided half-life: source,0.0,0.0
"Brasov, Romania",0.0,0.0
I’m tired of being “the roommate” to my gf’s family.,-0.4404,-0.4
my husband told me that he keeps touching my vagina because i’m “not dressing how i should be”,0.0,0.5
I'm so proud! Can you guess what she drew for the letter Y?,0.5697,1.0
My kitchen at night,0.0,0.0
"My mom’s cat, Binki. She sent this picture because she was excited Binki lost weight.",0.0258,0.375
A brag about my gynecologist,0.0,0.0
You shall not pass,0.0,0.0
Just Water,0.0,0.0
"I'm almost 18, a legal adult, and I Ifeel like I haven't lived enough.",0.4062,0.10000000000000002
My heart can only grow so big.,0.0,0.0
Just one more mass killing and they'll find the secret base,-0.6887,-0.23333333333333336
Joyboy says Vultures is very recent and was made in Saudi Arabia,-0.3182,0.0
I felt violated while reading this bio😂,-0.5267,0.0
Sakura Matou [Fate/Stay Night] (3000x4800),0.0,0.0
A newly opened pedestrian bridge in Dallas was immediately vehilated.,0.0,0.13636363636363635
BG3 Drinking Game,0.0,-0.4
Operator saves cow from drowning with pinpoint accuracy,0.0,-0.13333333333333333
"12-year-old girl does an incredible performance of ""Defying Gravity"" from Wicked on Britain's Got Talent",-0.1531,0.9
What are the disgusting things that most people do anyway?,-0.5267,-0.25
OP pub spotted in my city,0.0,0.0
Where is everybody?,0.0,0.0
I think hes funny,0.4404,0.25
Won a limited 4090 in a Cyberpunk design (only ten of them in the world),0.4215,-0.023809523809523808
Anyone know a girl like Roxy is real life?,0.3612,0.2
GoPro footage of dissidents ripping of Chinese flags in San Francisco,0.0,0.0
"As whistleblower David McBride pleads guilty, pressure is building on the Albanese government",-0.6124,-0.5
Fluffy pitbull keeps getting fluffier,0.0,-0.2
"""At last we will have our ROTJ""",0.0,0.0
Dynamike revives after being killed by Shelly in Starr Park.,-0.4404,-0.2
A little white board conversation I had in my dorm,0.0,-0.09375
nightmare,0.0,0.0
Alright guys time to shut down this subreddit,0.25,-0.15555555555555559
I purchased this years ago and can you guess? If no correct guesses I can add another one as a clue.,-0.296,0.0
Would you trust that fucker in your body?,-0.25,0.0
If I speak...,0.0,0.0
To film a video with her sister,0.0,0.0
[OC] Why does this turn lane has a center line painted on it.,0.0,-0.1
Amazon promised tens of thousands of employees they could work remotely permanently then does this - the only way we can protect ourselves is by unionizing,0.7003,-0.05
'Rifle Raffle' for Monroe Elementary School cheer squad drawing frustration from parents,0.0516,0.3
AITA because I let others eat my food which contains unrefrigerated eggs?,0.0,0.0
Why they showing this to me when they removed it 17 days ago? 💀,0.0,0.0
How the hell did no one in-universe notice that a corpse was inside the decayed Spring Bonnie animatronic?! Were Phone Dude and the others seriously THAT high?! 🤦,-0.9407,-0.06666666666666665
Pelvic floor therapist said women should only pee 2 - 3 times a day,0.0,0.0
2meirl4meirl,0.0,0.0
BRUTALITY KOMBAT ,-0.6124,0.0
*eagle screeching*,0.0,0.0
"Cousins pc bricked for almost a year, simple bios flash solved it. Lmao",0.7184,0.3
'OpenAI crisis deepens as 3 other senior researchers resign',-0.7579,-0.125
I Knew It.,0.0,0.0
"Has Trump Gone Even Crazier? Forget parsing every Biden utterance. The likely GOP nominee is forgetting where he is, stumbling over words, and waxing full fascist.",-0.6808,0.175
Bi🐺🐺irl,0.0,0.0
"""First Few Minutes of IAE2953"" - The Film",0.0,0.024999999999999994
Made a book for the baby I nanny for his 1st birthday 🥳,0.0,0.0
short kings,0.0,0.0
Rare bird at Sydney Airport,0.0,0.3
Who’s a good dog?,0.4404,0.7
Not a meme but why is Disney promoting crippled Vader nazi saluting,0.5023,0.0
"Tim “Uncle T” Smith AKA Totchman is an avid message board poster under the name “the real Totchman” Hes posted about Stallions, the NCAA, Harbaugh etc.",0.296,0.225
Team Fist Bump currently leads the Splatfest results for winning the Sneak Peek!,0.5707,0.3125
"After undergoing testing at UFC PI, Aljamain Sterling leaning towards featherweight move",0.0,0.0
ITAP of a seagull staring down the camera at the Roman coliseum,0.0,-0.15555555555555559
Stephen Curry needs to let Draymond Green cuck him in order to be top 10 all-time,0.2023,0.15
Just FUCKED This FUCKING Character what THE FUCK should I call FUCKING call it FUCK?,-0.9393,-0.52
I moved the cat tree to sweep and found out where all of my hair ties have been hiding. Culprits in photo 2.,-0.296,0.0
You are all doing Superbloom wrong,-0.4767,-0.5
You have got to be kidding me.,0.1027,0.0
Going for a trip next week and my luggage handle disintegrated 😵‍💫,0.0,0.0
My GSD mix pup before we got him vs after we adopted him,0.0,0.0
Wtf lol.,-0.25,0.15000000000000002
really coming up on a full year since he posted this,0.0,0.275
UP government to build cricket stadium in Mohammed Shami's village,0.0,0.0
"X has been placing ads for Apple, Bravo, IBM, Oracle, and Xfinity next to pro-Nazi content",0.0,0.0
"So, Go Global offered 60 million for Baby, but DOM won the bid for much less? Would the judge have approved this if the Go Global bid would have been a better outcome for the shareholders? Credit to Teufel Hunden on X.",0.9542,0.08333333333333334
"If at first you don’t succeed, try try try try try again",0.4939,0.25
"Texts between me and my mother-in-law, 2 days before her son tried to kill me",-0.6908,0.0
Chiefs DST is the one you want for playoff weeks.,0.0772,0.0
Let's running around,0.0,0.0
My Cat Thinks My Dog's Breath Stinks!,-0.3164,-0.75
Back in my country,0.0,0.0
X,0.0,0.0
"2023 KBS Music Bank Global Festival announces lineup for December 15 in Seoul: Sunmi, Hwasa, fromis_9, (G)-IDLE, TXT, aespa, IVE, Xdinary Heroes, ZEROBASEONE, RIIZE, NCT 127 and NCT DREAM + SF9's Rowoon and IVE's Jang Wonyoung announced as MCs",0.8494,0.0
"When asked about Russian relations with Europe, Putin spoke in metaphors. He hinted that all is well in Russia and it would be Europe's loss if Russia lost ties to Europe.",-0.3612,0.0
"""Here you go, honey. That's about all the recycling... I can handle today.""",0.0,0.0
Always Covers Her Eyes When She Sleeps,0.0,0.0
Hate Crime-proof Hijabs,-0.5719,-0.8
231117 Meet YOONCHAE of KATSEYE,0.0,0.0
Jet airplane flying low over spectators,-0.2732,0.0
My Father in the Early 1950’s,0.0,0.1
This dog seems to enjoy the roof,0.4939,0.4
candy making process,0.0,0.0
"I got some petty revenge on an abuser, which was nice.",-0.7184,0.6
Right after the entity is displeased no less,-0.6249,0.1845238095238095
Thought this might fit here.,0.3612,0.4
Saddest moment in the show?,-0.6124,0.0
Soulja Boy voice “DRAAAAKEEE?,0.0,0.0
Turning mid,0.0,0.0
I am so good at this game🫠,0.4927,0.7
SMW-Style resprite of Mario & Luigi alongside with some other characters.,0.0,-0.125
"[Post Game Thread] #22 Villanova defeats Maryland, 57-40",-0.3182,-0.4
My wife and I just got married in Vegas!!!,0.0,0.48828125
Ask and you shall receive - the PIZZA ball pit,0.0,0.0
Taylor addresses Cristo Redentor projection,0.0,0.0
Apparently this is a thing now.,0.0,0.05
The army.,0.0,0.0
Can a Kobold Save The World? part 56,0.4939,0.0
Cursed k,0.0,0.0
idog from my childhood yellowed from cigarette smoke,0.0,0.0
Had a good laugh the first time it happened...wanted to rewatch it lol,0.8519,0.5125
"In occupied Mariupol, the number of graves on the Starokrymske cemetery is increasing. People are buried in trenches as unidentified persons. The death rate in the city is rising due to the critical state of healthcare caused by the russian occupiers.",-0.7964,-0.041666666666666664
I remember in Geology the professor said this and everyone was shook,-0.1027,0.0
U.S. Department of Justice backs tenants in case alleging algorithmic price-fixing by big landlords and real estate tech company RealPage,0.4939,0.1
The dangers of frying a turkey.,-0.4939,0.0
LPL : All the possible outcomes of the World Finals,0.0,0.0
Only 90's witches know this one,0.0,0.0
"""It's for school."" ""Cute Girl Bra?"" ""Yeah...""",0.4588,0.5
Learning to ride a Bike ,0.0,0.0
Remember during Museum event where Seele had higher education points than Bronya and Svarog?,0.0,0.25
Grandma got them dance moves,0.0,0.0
Moonmoon meets the average Kick streamer,0.0,-0.15
My Birthday Freebies,0.4215,0.0
When Torrent gets an upgrade ,0.0,0.0
do I wake him up?,0.0,0.0
Destiny learns about Hasan's waiting room,0.0,0.0
This is my boyfriend’s cat Jane,0.0,0.0
"""Basically you wear your vaginal fluids as perfume.""",0.0,0.0
When it’s so sad you need to laugh,-0.1005,-0.1
‘Kissing Booth’ Star Taylor Zakhar Perez Responds to Jacob Elordi Criticizing Their Netflix Films: ‘It’s a Shame That Was His Experience’,-0.6808,0.0
"TIL New Orleans was the wealthiest city in the US during 1830-1840. By the 1860's, New Orleans had the 3rd largest port in the nation and was 2nd overall in per capita income in the US.",0.4939,0.05454545454545454
Furry_irl,0.0,0.0
"[Murrary] The Brewers have non-tendered Brandon Woodruff. “We remain very open to his return to Milwaukee, and regardless of what uniform he wears next, Woody will always be a member of the Brewers family,” Matt Arnold said.",0.0,0.0
Taylor Swift Fan Dies during concert in Rio de Janeiro,0.4767,0.0
💀,0.0,0.0
"Chat, what year is this??",0.0,0.0
Motorhead - Ace of Spades,0.0,0.0
🔥 The Lion cubs of the Serengeti ,0.0,0.0
Another 1118 shares booked!,0.3595,0.0
A Wunky Diving Experience!,0.1511,0.0
Maybe maybe maybe,0.0,0.0
"You’re a Nazi too, creep",0.0,0.0
AITA I (m27) feel like divorcing my wife (f25) because she keeps using my money to help her family who I do not get along with?,0.6369,0.0
Tom is absolute mad man for this 😆,-0.4939,-0.2125
Portugal just ran on 100% renewables for six days in a row,0.0,0.0
International Legionaire AMA! Replying as honest as possible.,0.5562,0.19999999999999998
What its like to be on the internet,0.3612,0.0
Daily Mail mistakes Conan Gray as Olivia Rodrigo’s boyfriend,-0.3612,0.0
My bf got me these cute Titanfall keychains!!!,0.5962,0.9765625
Hells Kitchen,0.0,0.0
John wick,0.0,0.0
He won't let his disability deter him,0.0,0.0
My family always think I am sus in bathroom when I am just doing this,0.0,0.0
anime_irl,0.0,0.0
"Let's see if Darwin is right, or if Tiktok is right.",0.0,0.2857142857142857
meirl,0.0,0.0
Advice on finding a home,0.0,0.0
Invincible has what The Boys lacks.,0.4939,0.0
You are my special...,0.0,0.35714285714285715
What,0.0,0.0
We need to talk,0.0,0.0
Lesbian sex is so complicated,0.0,-0.5
A little homage I noticed on Smackdown,0.0,-0.1875
Cillian Murphy to Receive 2023 Desert Palm Achievement Actor Award at Palm Springs Film Fest,0.5423,0.0
"We all joke about Grima not noticing 10,000 Uruk's in Sarumans front porch, but what about this idiot who didn't notice an entire forest until Saruman pointed it out to him",-0.692,-0.4
Healing By Feeling,0.128,0.0
Not happening,0.0,0.0
The artwork cover of both games,0.0,0.0
The fact that these exist and can be bought,0.0,0.0
VLC Media player has encountered problem with Windows,-0.4019,0.0
We were created in a lab.,0.25,0.0
Poor thing haha,-0.0258,-0.1
Random cat🐈,0.0,-0.5
Sarah Get Your Head in the Game,0.0,-0.4
Every little thing helps,0.323,-0.1875
Leaked minis from the upcoming livestream 😱,-0.3182,0.0
me_irl,0.0,0.0
We lost our sweet boy today. I’m still in shock,-0.2263,0.35
"Um, what? (from angryupvote)",0.0,0.0
Post Game Thread: The Los Angeles Lakers defeat The Portland Trail Blazers 107-95,-0.4588,-0.4
"With the return of OG season 7, which skin do you think was more of a grind?",0.0,0.5
[Highlight] Refs do not call blatant foul by Paul George against Sengun,0.0,-0.5
This sweet dog showed up to my parents house a few months ago. This is her today.,0.4588,0.07499999999999998
American GenZ supporting and praising an actual terrorist to flex against pro-Israel rightoid.,0.1779,0.08333333333333333
"You can get ""The Only Half-Life Achievement"" on the HL update notes website",0.0,0.0
happy twenty fifth,0.5719,0.8
"[Dropping the Gloves] ""After Matt Cooke ended Savard’s career, there was a secret meeting the next time the two teams met ...the message was clear: Matt Cooke needs to fight [Shawn] Thornton on his very first shift, or things would get ugly.""",0.0,-0.13499999999999998
Big Pussy Bonpensiero Vs. Satanic Ass Metal,-0.5423,0.0
"Autumn evening at Fuji [3770x3070, OC]",0.0,0.0
Due to collective reasons,0.0,-0.125
I'm dying inside please help,0.6124,0.0
"Is Teletubbies’ Tinky Winky gay? This evangelical preacher certainly thinks so: ""He is purple: the gay pride colour, and his antenna is shaped like a triangle: the gay-pride symbol.""",0.743,0.34920634920634924
She’s just looking,0.0,0.0
We've got the chonkiest reindeer,0.0,0.0
girls since yall cant figure it out I'll just say it on behalf of all guys.,0.0,0.0
RIP ,0.0,0.0
I asked for an innovative new snow blower design. Not mad,0.6734,0.3162878787878788
Ye fans when a song played on the Radio has censoring,0.34,0.0
Israeli solider throws stun grenade into mosque and asks friend to film it ,0.4939,0.0
Walked to the top of stairs to be greeted by this chonker,0.4404,0.5
My sibling wants to play but I don’t want them seeing things like inappropriate signs.,0.6597,0.2
"What the Dutch? When the bike parking is so well designed that even Porsche drivers cannot resist to park there... (Beursplein, Amsterdam)",0.4101,0.0
True Gentleman ,0.4215,0.35
Creeper of the House,0.0,0.0
Alright. It’s down. What were you last doing on c.AI?,0.25,-0.07777777777777779
hmmm,0.0,0.0
Why do we tip based on the cost of the meal?,0.0,0.0
"State government to pay landlords $10,000 to drop short-stay rentals",-0.3612,0.0
How has morbid curiosity screwed you over?,-0.4939,0.0
Virgin Krennic vs Chad Thrawn,0.0,0.0
"Even in space, peace eludes us.",0.5423,0.0
BBC analysis of inconsistency from IDF walk tour around al-Shifa hospital,0.0,0.0
What healing does to you,0.0,0.0
"A unique XIV century church, near Knjaževac, Serbia",0.0,0.2375
[META] do we really need a new “should I get this game?” Post every half hour,0.0,-0.05757575757575758
rule,0.0,0.0
Context in the comments!!!,0.0,0.0
"It should come as no surprise that when humanity was initially discovered and presented with advanced genetic engineering technologies as a welcoming gift from the rest of the galactic community, they IMMEDIATELY used it to “uplift” their various “pet” species.",0.7717,0.13333333333333333
What Game?,0.0,-0.4
I know it’s majestic but please..,0.0,0.0
Scoop from Kara Swisher: Many more major departures from OpenAI coming tonight. Understands the conflict was to do with the profit/Nonprofit motive of the company,-0.1779,0.3541666666666667
What's your opinion on Glamrock Chica?,0.0,0.0
"Wayne Co. lieutenant kept working after allegedly beating girlfriend, a fellow officer",-0.4588,-0.1
My gear 5 cosplay,0.0,0.0
Bi↔️irl,0.0,0.0
[Homemade] Solar System cake,0.0,0.0
A man who lives on a plane,0.0,0.0
Egg👗Irl,0.0,0.0
I think I just had a seizure caused by my husband strangling/choking me.,0.0,0.0
Spike ate your legendary starr drops,0.0,1.0
My security officer pawtrolling the grounds,0.34,0.0
HOLOSTARS English -ARMIS- Day 1 Debuts Thread!,0.0,0.0
"This is so wrong, teemo jungle???",-0.6738,-0.5
Potential investment opportunity in merchandising for a Paddy's Pub.,0.4215,0.0
Level of worldbuilding: summon all the top 1 leaders of all the faction on the frontline,0.2023,0.5
Is there a lore reason that rocksteady needed 9 years to make a basic looter shooter? Are they stupid?,-0.5803,-0.39999999999999997
(For Answer) I've got the master plan...,0.0,0.0
I was Orin at Anime NYC today!,0.0,0.0
Laughed Out Loud on this scene. S2.Ep.13 TCW.,0.4588,0.39999999999999997
stringsInANutshell,0.0,0.0
This one will take a lot of time...,0.0,0.0
ITAP of the woods,0.0,0.0
AITA for not letting my daughter to go over to my SIL's house after her kids dumped my daughter's bindi bag.,-0.4019,0.0
Fun at the Office,0.5106,0.3
the inner workings of the pyro jumpgate,0.0,0.0
Let's fucking go,0.0,-0.6
And Jeezits.,0.0,0.0
"With the Burrow injury, the Chiefs Defense now has the best playoff schedule facing essentially only backup QB's",0.4404,0.5
Lost my girl of 15 years today. I'll miss her forever.,-0.4404,0.0
White House blasts Elon Musk for promoting ‘antisemitic and racist hate’,-0.3612,-0.4
Our crush is washed up💔💔,-0.1531,0.0
Coruscant Nine-Nine,0.0,0.0
231117 Meet DANIELA of KATSEYE,0.0,0.0
I’m so scared I ruined my only chance at kids.,-0.6779,0.0
Up close encounter with a Sperm Whale,0.0,0.0
Just realized this bread my sister made for Christmas belongs on this sub,0.0,0.0
Over Reaction [OC],0.0,0.0
"CORRECTING THE TITANIC: The Chronology of BBBY as a Company from March 2002 to April 2023, Part 1:",0.0,0.0
DEAN - DIE 4 YOU (Visualizer),-0.6841,0.0
Gets 14 *mink* *mink* *mink*'s,0.0,0.0
HOW TO GRAB MEN:,0.0,0.0
Warm sun beams happiness relax,0.8126,0.6499999999999999
cuteness overload,0.2023,0.0
Dude's trippin fr,0.0,0.0
[Game Thread] Colorado @ Washington State (10:30 PM ET),0.0,-0.4
Happy Gesture,0.5719,0.8
'There's people that need water.' Taylor Swift pauses Eras show in Rio to help fans,0.5423,0.0
Uh oh….,0.0,0.0
"World's 280 million electric bikes and mopeds are cutting demand for oil far more than electric cars, researchers say",-0.25,0.0
"15 Russian warships destroyed, 12 damaged, Ukraine's navy says",-0.765,0.0
cursed_iykyk,0.0,0.0
"Jones Bar-B-Q Diner in Marianna, Arkansas, is considered the oldest Black-owned restaurant in the U.S., operating for over 100 years, and was honored as an American Classic by the James Beard Foundation in 2012",0.5859,0.08333333333333333
The ladies arrive at the pleasure grotto,0.5719,0.0
to use glory-howl,0.0,0.0
Is BeryL the true mastermind behind all the recent Worlds storylines?,0.4215,-0.01666666666666668
I cast testicular torsion Mf's when I use reflect:,0.0,0.0
I’m allowed to make this joke cos I’m autistic myself pls don’t take any offence,0.1531,-0.2
This brand new Sharpie had no ink in it,-0.296,0.13636363636363635
Up close encounter with a Sperm Whale,0.0,0.0
Denims (Hasan orbiter) just read the full Osama Bin Laden letter on Twitch and then doubles down on Hasan's 9/11 opinion,0.0,0.0972222222222222
"""Im just a baby""",0.0,0.0
just as god intended,0.2732,0.0
I always feel like somebody's watching meeee,0.3612,0.0
Little Gui must be stopped! (Copypasta),-0.2942,-0.234375
I made an acorn pendant,0.0,0.0
Furry_irl,0.0,0.0
