title,sentimentNLTK,sentimentBlob
🥺😳👉👈,0.0,0.0
Lobotomy 😁,0.0,0.0
I bought these in the 1980s.,0.0,0.0
Fox Playtime,0.0,0.0
"""Omg guys look how not racist I am!""",0.5442,0.0
"Mf’s be like: “Yharim is so hot!”, and this is how he probably looks like under the armor",0.6476,0.3125
I just joined the sub.,0.0,0.0
Indian Woman's Justice,0.5267,0.0
iM aCTuAlLy A vEry NiCE giRl,0.4754,0.78
Should’ve been playing Minecraft instead.,0.2023,0.0
[Postgame] Gators whoop FSU 89-68,0.0,0.0
Ya'll this new DLC fire 🔥🔥🔥,-0.34,0.13636363636363635
Mr. Koseman seems to have a thing for vacuumorphs. Tbh I can only respect him for it. (cw questionable vacuumorph fanart),0.2263,-0.25
I'm never going to financially recover from this,0.0,0.0
231117 Aju Korea Daily: S. Korean police hands over BTS member V's alleged stalker to prosecution,-0.4939,-0.05
Please ignore the (temporary) printer set up. No cat here 🤷‍♀️,-0.34,0.0
Blursed_Orphan,0.0,0.0
Still can't believe the editors allowed this.,0.0,0.0
I FINALLY TOOK MY SHAHADA,0.0,0.0
Insta story,0.0,0.0
A freshwater crab sits on the edge of a waterfall.,0.0,0.0
Racismo explícito no reddit,-0.296,0.0
"How did the First Order not only get access to, but convert all of Ilum into Starkiller Base?",0.0,-0.18333333333333335
SKT Huni calls Faker the greatest shotcaller of all time and the reason for T1's success,0.836,0.65
It was so uncomfortable to watch....,-0.5214,-0.5
erenbros don't worry. i fixed the ending for your sake.,0.3412,0.1
A secluded stately home in autumnal Scotland.,0.0,0.0
Daniel Vogelbach has been non-tendered,0.0,0.0
the origins of this holy sub,0.0,0.0
Still will see it 10 times in theatre to support Nintendo!!!,0.5538,0.0
Millions of dollars in questionable Houston water department contracts uncovered,-0.296,-0.5
He did the little one dirty af,-0.3862,-0.39375
Hmm... 🤔,0.0,0.0
R.I.P. Edith,0.0,0.0
What’s the best app for seriously learning guitar?,0.5423,0.33333333333333337
This South Island giant moa (Dinornis robustus) definitely didn't skip leg day.,0.4019,0.0
How close to a cis gender woman do I look?,0.0,0.0
Making me cry will not get you a refund,-0.4767,0.0
Happy Sad Happy Sad 🙃,0.296,0.15000000000000002
Official sticker confirms what Childe meant by that gesture in the cutscene,0.0,0.0
"For the first time in 15 years, I cleaned the sides and back of oven and area behind oven",0.0,-0.05000000000000001
This is Smoke she’s my hippo,0.0,0.0
The Greys Anatomy hairstyle . lol,0.4215,0.8
Is this really what FFXIV dungeons are like?,0.3612,0.2
Shitposting daily because I'm copying that other guy (day 152),0.0,-0.0625
Goodwill find!,0.0,0.0
Couldn't find one. Had one made instead.,0.0,0.0
disney princess and animals,0.0,0.0
I have to deal with this face when on a call and she wants a walk,0.0,0.2
"War and Peace, Part IV (1967) - Filming the fire of Moscow",-0.4215,0.0
Credit @his_animations on Twitter,0.3818,0.0
My wife and I put together a cosplay of Noodle and 2D for a party. Love from stateside. <3,0.8689,0.75
Scottie Barnes with the SLAM DUNK!,-0.561,0.0
Netflix pushed me back to piracy and now i’m not going back,0.0,0.0
current setup ☁️,0.0,0.0
Why do they have this head option in Madden? Dude looks like he’s 60,0.3612,0.0
Telling me NO on my birthday!?!?,-0.5963,0.0
Goth goes cowgirl?,0.0,0.0
"Patrick Swayze, shortly before dying from cancer in 2009.",-0.6597,0.0
Albus wishes you good luck for your finals,0.7579,0.7
"Thank you RobTop, very cool",0.624,0.45499999999999996
Would cyrus work for your oc as a butler?,0.0,0.0
Pitbull at Dog Daycare,0.0,0.0
When you're sad but your own English cheers you up.,0.4767,0.033333333333333326
Catgirl,0.0,0.0
He spotted his First Lady bug 🐞,0.0,0.25
"Could there be a dimension overlaying ours, invisible and inaccessible to us, but a realm where Non-Human Intelligences (NHI) operate freely?",0.8047,0.4
I went to my first piano concert and I am so disappointed,-0.6113,-0.25
Simon Stone - Sir Jim Ratcliffe is likely to appoint former Juventus and Paris St-Germain executive Jean-Claude Blanc as Richard Arnold's replacement,0.0,0.0
Crei que era mi dia de suerte 🤑,0.0,0.0
wtf happened :(,-0.7717,-0.625
European Commission Pulls Advertising From X/Twitter Following Elon Musk’s Latest Antisemitic Outburst,0.0,0.16666666666666666
i love them both sm,0.6369,0.5
Let’s play a game: find the second cat,0.34,-0.2
(The Dangers in My Heart),-0.4939,0.0
Is social media getting frustratingly stupid or am I just getting old?,-0.7506,-0.2222222222222222
"Just watched my Roommate let the company he works for steal money from him to re issue his paycheck that they themselves lost, with proof mind you, a paycheck that is now 4 weeks late.",-0.6705,-0.3
Bartender Eula & Ei,0.0,0.0
Laid off today. It’s so over.,0.0,0.0
"Someone has snuck into the kids room and into the kids bed, and knows he's not supposed to be there and is trying real hard not to be noticed.",-0.1027,-0.4375
Did anyone know this was possible without mods?,0.0,0.0
Good Lord they’re pretty dogs.,0.7269,0.475
Decided to try my hand at some Walgreens mystery packs. Hits on 2nd slide.,0.4939,0.0
Can't Fight That Logic,0.2924,0.0
"Anyone ever bought a firearm simply because of this game? My Trail Carbine, a Winchester 1894 trapper in .44 Magnum",0.0,-0.2
I AM buying what she’s selling!,0.0,0.0
Madison's Short Live on IG. [November 2023],0.0,0.06818181818181818
231117 KBS Music Bank Twitter Update with Hong Eunchae (2) (feat. Lee Chaemin),0.0,0.0
Man caught driving after 9 lifetime driving bans gets hefty jail time: Peel police | CityNews Toronto,0.0,-0.1
Could a sick dog do this?,-0.5106,-0.7142857142857143
My husband after finishing the show last night,0.0,0.0
Anyone ever notice Angela Kinsey is a pretty visible extra in the Chris Farley Seaworld sketch?,0.4939,0.125
i just discovered this sub today and felt motivated enough to organize my bathroom cabinets!,0.5093,0.0
"Now that's what I call ""Space efficient""! cr.: Space Exploration Modpack",0.2942,0.0
Giving my sister the side eye 😒,0.34,0.0
On a recipe for pickled chillies,0.0,0.0
Nothing better than sunbathing on the balcony!,-0.4015,0.625
Stain uneven,0.0,-0.2
Lokiest Loki,0.0,0.0
They are in the corner plotting world domination!,-0.126,0.0
SI raped 4 year old girl,-0.6808,0.1
A eficiência do estado Brasileiro (choro moderado nos comentários) ,0.0,0.0
Dream Academy Final Lineup Revealed,0.25,0.0
PizzerKek had enough 😱😱😱😱,0.0,0.0
Madlad parents,0.0,0.0
"Could the Bug Planet color scheme have worked for Vegeta going forward, or is it too ugly and belongs in the memoryhole?",-0.5106,-0.7
One of the cases of unjustified hate for a shiny Pokemon in my opinion,-0.5719,-0.8
The next Demiurge to join the fight against Jagganoth,-0.1027,0.0
Toji’s worm,0.0,0.0
Drawing of our Demon Mommy,0.0,0.0
The golden trio of Frauds🔥,0.0,0.3
no OBVIOUSLY its a whale,-0.296,0.0
my wife material tier list,0.0,0.0
"Elephants are intelligent, social, empathetic animals who display 'ah ha' spontaneous problem solving behaviour.!!",0.8118,0.5902777777777778
ADUM!!! >:C,0.0,0.0
THIS SHOWED ACTING,0.0,0.0
Hype,0.0,0.0
The king returns,0.0,0.0
What is this?,0.0,0.0
Sneak Preview of the Seal Coming for Thanksgiving Dinner.,0.0,0.0
*laughs* Sensational😉,0.0,0.0
Mona goddess (by @hoshino_arisu),0.0,0.0
"I’m not a stunt man/getaway driver, nor am I Officer K, I’m just a socially inept loser",-0.5267,0.03333333333333333
Has anyone else taken the time to really look at the pictures hanging at Ables or at Brewsters? So adorable,0.5413,0.35
What's your favorite part of my face,0.4588,0.5
"[Hromadske] Ukrainian hockey player Oleksii Lohinov, 23, was killed in action for Ukraine, the Ministry of Youth and Sports and the Ukrainian Hockey Federation have reported. After the start of the full-scale invasion, the athlete joined the Armed Forces. He died on November 8, 2023.",-0.8442,-0.05
She would be incredible!!,0.0,1.0
This sad boy likes my backyard,-0.0772,-0.5
My other cozy baby - he did this himself!,0.0,-0.1875
"Elon Musk: ""From river to the sea"" will NO LONGER be allowed on Twitter. Anyone calling for genocide of any people will be suspended",-0.7213,0.0
winter we all know you’re gay <33,0.0,0.4166666666666667
somebody asked me how i grapple cap on glitch so fast,0.0,0.2
They gave this to me...my wife just doesn't believe me,0.0,0.0
My crew is watching me turn off the oxygen every battle so I don't have to upgrade the reactor.,-0.3818,0.0
tell me something cute about my face please,0.6486,0.5
A beautiful ode to the kitties of the night that we all love so dearly,0.9138,0.675
Arizona Snowbowl opening day.,0.0,0.0
What's wrong with expressing your feelings about the Traitor's Rag?,-0.4767,-0.5
My boyfriend has his own bed.,0.0,0.6
Floors refinished!,0.0,0.0
[Taught By Mizuki] Manga strip fanart,0.0,0.0
MC’s whole profile is just about bothering retail workers.,-0.3818,0.2
"People like to call All-Might and the government morons for not killing AFO, but just remember that he lived through being reduced to THIS(Spoiler mark just in case):",0.3309,-0.8
Hilton Pulls Ad Attacking Ryokans in Japan After Online Uproar,-0.4588,0.0
My perfect son Franklin,0.5719,1.0
Taylor Swift confirms a young fan lost their life before her show in Brazil.,0.2023,0.1
Can we have our babies back now?,0.0,0.0
Her gorgeous smile,0.7579,0.5
[Fo4] someone tell me what mods are these lol ,0.4215,0.8
There’s a fly in the house,0.0,0.8
"QC FIRST HAUL Part 2, what do I keep ?",0.0,0.25
"Ssssssssscuse me, my people need me",0.0,0.0
Matty bringing a kid at his first concert on stage in Montreal ,0.0,0.25
guy who i’ve told so many times i don’t want anything to do with and that he makes me extremely uncomfortable,-0.3804,0.0
tf bruh 😭😭,0.0,0.0
Star Wars: Knights of the Old Republic Remake Is Dead,-0.836,-0.05
Magical girls,0.0,0.5
Vänsterhej was looking flat and sad so I gave him an emergency chonk transfusion,-0.6908,-0.2625
Nothing lasts forever ,0.0,0.0
Classic,0.0,0.16666666666666666
Sharpe becomes the yougest Blazers to reach 1000 points with a nice finish over AD,0.4404,0.6
In 2015 I booked concerts for my college and got Mac Miller to come. We paid him ~$60k in cash after the show. He took this photo later that night shortly after he received the case full of cash.,0.0,0.11666666666666665
Ask me a question about ELDEN RING and edit it to make me look bad,-0.5423,-0.6999999999999998
The first episode of Azumanga Daioh anime was released in 2002. Saddam Hussein died in 2006. Is it possible that he was a fan of the show?,-0.3182,0.125
🤷🏻‍♀️🤷🏻‍♀️✨,0.0,0.0
Terrified by comments my friend made,-0.2023,0.0
Mac Jones Reveals He Called Tom Brady To Discuss Never Calling Tom Brady Again,0.0,0.0
Had to say goodbye to Beans (11) and i miss him every day,-0.1531,0.0
SAME 🤚,0.0,0.0
Saturn released a commercial in 2003 that ironically highlighted the inefficiency of cars and how much space they occupy.,0.0,0.1
Damn the character models look drastically improved especially the textures on the design looks more detailed they also look more expressive,0.1027,0.44000000000000006
‘You don’t know everything’: Israeli intelligence operative begs forgiveness for hacking environmentalists on Exxon’s trail,0.6369,0.0
"grey, white, tan clouded tabby- nature names pls",0.0772,-0.025
Brandon Herrera openly supports actual murderer,-0.4767,0.0
Unexpected Biden handshake takes Indonesian president by surprise,0.2732,0.1
Idaho teacher arrested for rape of teen cops found driving her car because she was too ‘drunk to drive’,-0.8316,-0.25
231103 Yeji,0.0,0.0
"My city has a public pill/drug-testing facility (Canberra, Australia) and the stoners here are WILD..",0.0,0.05
"Worth it? 1963 ElDorado, paid 17K.",0.2263,0.3
Might have gone a little overboard,0.0,-0.21875
Trick or Treat :),0.6705,0.5
"Started as a joke, now my father isn’t my paternal father.",0.296,0.0
How to fix dynamic under eye wrinkles?,0.3818,0.0
After class walking,0.0,0.0
OMG THANK U THANK U THANK U THANK U!!! (Money Tree),0.9301,0.0
"[TV2] Erling Haaland: ""I always watched Cristiano Ronaldo on Youtube for his movements in the box: He made 2-3 moves before attacking the space he wanted to be in. It's kind of a duel in that situation vs centre-backs. Cristiano is the most important inspiration for me.""",0.4159,0.5
I would die for a majungasaurus as a pet,-0.5994,0.0
The library at my University,0.0,0.0
this is how I imagine orv looks like,0.3612,0.0
Meme: when deities evolve with the times...,0.0,0.0
"WJPS, My oil painting 12""x16""",0.0,0.0
“Goku solos this!” “Goku slams that!” Fuck all that! What verses or MC's does Vegeta solo?,-0.6571,-0.5
What simple misunderstanding did you make?,-0.4215,0.0
Tiger nageswara rao - Creepy,0.0,-0.5
The Next Series!,0.0,0.0
2024!,0.0,0.0
one armed bent over beer case row - is my form OK?,0.4466,0.5
Gotta love the realization…,0.6369,0.5
My baby is about to start a wonderful journey…,0.5719,1.0
Embrace Comet Meta,0.3182,0.0
Is travelling just another form of consumerism?,0.0,0.0
Ashley Tisdale,0.0,0.0
Ganyu (by: 笹戸せろり),0.0,0.0
[Steam] (Game) Half-Life,0.0,-0.4
I uncensored The Man panel,0.0,0.0
It is done,0.0,0.0
hard choices,-0.1027,-0.2916666666666667
"""Preble Penny"" Jane Doe (1968) identified as Albert Allen Frost",0.0,0.0
When weebs go too far...,0.0,0.1
wtf?,-0.5859,-0.5
"Picked up a copy of Mario galaxy at my local GameStop. However, I found a receipt in it. Apollo closer inspection, I think this is the receipt that was received when the game was sold NEW. How rare is this?",0.0,0.00909090909090908
"[Populism Updates] Liberia's celebrity president George Weah, who faced heavy criticism for corruption, has *lost* to his opponent, a 78 year old former vice president named Joseph Boakai. This is the first opposition victory in the nation's modern democratic history.",-0.4404,0.06999999999999999
I don’t know how to [redacted] myself,0.0,0.0
I've been cumming on the gap between my wall and bed for 5 years and it's beyond gross.,-0.4767,0.0
Mainstream?,0.0,0.0
My garden protector succumbed to the cold today 😔 . My last & only video of her,0.0,-0.19999999999999998
Até os idosos estão sofrendo pela síndrome Gamer,0.0,0.0
Quick time line of the Persona 5 games for those confused,-0.3182,-0.033333333333333354
60th Annual Golden Globe Awards (January 19 2003),0.4588,0.3
"""not cool humanity... Not cool...""",-0.2411,-0.175
Since when has opposing a real genocide going on as we speak been a sign of prejudice?,-0.5106,0.2
Picked up these 2 today!,0.0,0.0
Why would Naofumi help you with that?,0.4019,0.0
The fact that this isn't a snow globe location tells me that not one person at Bethesda has seen Planet of the Apes. Shame. It's a classic.,-0.4767,0.16666666666666666
"An abandoned neighborhood, where all the residents were kicked out by the government",-0.4588,0.0
Persephone redesign,0.0,0.0
>.<,-0.3182,0.0
"Can't swim there, mate.",0.0,0.0
This has me dying 🤣🤣,0.0,0.0
Bills thoughts on Philly & their statues,0.0,0.0
"What is the difference of JP Deviljho and International Deviljho, Answer: The letter D",0.368,0.0
Surprised with a Kamen Rider birthday,0.2263,0.1
"Besides turning it on, is there a way to tell if this is a gas line or a water line?",0.0,0.0
Baldur's Gate 3 by TheMegglesArt,0.0,0.0
Concept Art for Unused Venom Abilities,0.25,0.0
Can't wait to give this a try.,0.0,0.0
Here it is! The Truth!,0.4374,0.0
Franticshipping height differences throughout the years,0.0,0.0
My parent’s divorce is clearly to blame for getting my period at 11,0.0772,0.10000000000000002
🌟 HAPPINESS GIVEAWAY🌟,0.5574,0.7
Aishwarya Rai x Sabyasachi,0.0,0.0
Four years after rescue...,0.0,0.0
"Massive cryptomining rig discovered under Polish court’s floor, stealing power",-0.6369,0.0
I saw the face of god and it was weeping,-0.2023,0.0
Timothy Hill 🫡 # 25,0.0,0.0
Made this on the fly,0.0,0.8
Been awhile since I did these and you guys really liked them. So I got creative again and present to you: Horrible inspirational VShojo quotes Part 2!,0.7479,0.14500000000000002
WHAT THE FUCK IS 7U?🔥🦅🔥🦅,-0.5423,-0.4
"ON AUG 16, 2023 | | ""Instinet *failed* to timely & accurately report data for **TENS of BILLIONS** of order events to the Consolidated Audit Trail (CAT) Central Repository in VIOLATION...From June 22, 2020 to January 2023 | Instinet was the biggest defaulting firm during the GME buy freeze FRONT",0.0516,-0.07499999999999998
Apna aisa hi hai,0.0,0.0
Sasha Skochilenko: Russian artist who swapped supermarket price tags with anti-war messages jailed for seven years,-0.4939,0.0
electric field,0.0,0.0
The most terrible mask for enemies,-0.7645,-0.25
Bridges is back,0.0,0.0
You think they would be friends?,0.4767,0.0
Tesla can now register vehicles sold in Texas,0.0,0.0
Apple Pausing Advertising on X Following Latest Elon Musk Controversy,0.0,0.25
Downtown Houston kitchen,0.0,0.0
Made a hellboy head in my ceramics class,0.0,0.0
Topaz's side view (by: F U T S U K A Y O I),0.0,0.0
Rainy Day by timbougami [Original],-0.0772,0.375
Update on this guy,0.0,0.0
huh.,0.0,0.0
*Slaps roof of Kar* {Feat my Tav Bard: Floop Doopson},0.0,0.0
Dance like no one is watching,0.0772,0.0
Strip tease pen. Late 50 and early 60s,-0.3182,-0.09999999999999999
what your favorite minecraft mob says about you (or smth),0.4588,0.5
Let them cook,0.0,0.0
A Jedi interceptor with an imperial coat of paint,0.0,0.0
Our beauuutiful front yard meadow/prairie looking so very autumnal this week. ✨,0.0,0.2
Just played the new Dr Who deck at my LGS and someone ruled something strange about the partner mechanic…,0.1531,0.043181818181818175
Stuck,-0.25,0.0
"I really hope the new dungeon is hard, mechanic heavy and fun. I really hope boss health is lower than GotD.",0.7956,0.057449494949494945
Feeling pretty!,0.6114,0.3125
Jennifer while in Vegas | IG November 2023,0.0,0.0
Title,0.0,0.0
Someone stole the blanket I made,0.0,0.0
Once and Future Badass Indeed,-0.1531,0.0
Help! Dad is abusing fish,-0.1511,0.0
"If orange human fire is harmless, green hellfire can hurt them, what does blue do?",-0.5859,-0.06666666666666667
"Novelty plant, no watering, no moving the pots, waxed underneath, grows so fast, when I bought it it was just a tiny little pile, now it's about to bloom, I've never seen anything like it, I'm ecstatic, I'm looking forward to the blooms🥳",-0.2982,0.00416666666666667
Is this autism “infograph” accurate? #2,0.0,0.4000000000000001
"They are all nearly the same price, in fact, the Switch may be cheaper",0.0,0.05
Dragon GoFundMe has been re-opened,0.0,0.0
MOVING HOME!!!!,0.0,0.0
‘Tis the season,0.0,0.0
Nadja is still a kitten but her floof is strong,0.6652,0.4333333333333333
231115 Just 04z Being 04z.,0.0,0.0
This is why States that consider doing away with trade licensing are fucked.,-0.6597,-0.6
[Captain America] Why did Dr. Erskine's individual death mean basically the end of the super soldier program?,0.0,0.006944444444444438
Fire Sale gang stay winning,0.25,0.5
"""See because it makes her look like a bee, and she's a bee.""",0.3612,0.0
Say something nice about Tomo,0.4215,0.6
the gang,0.0,0.0
"Wow, jdong really cares about other people, especially when he stares at his phone while driving! 😀godly Christian man things onlyyyy😜✌️",0.8118,0.03500000000000001
Please learn the difference,0.3182,0.0
4 an half minutes to eat a worm,0.0,-0.16666666666666666
Perfect for my pair of boats,0.5719,1.0
Icky features on Superdrug's TikTok for Trans Awareness Week,0.0,-0.3
Found outside the entrance to the park,0.0,0.0
Sam Altman out as CEO of OpenAI. Mira Murati is the new CEO.,0.0,0.13636363636363635
is there a safe sedative I can give my bunny to trim his nails?,0.4404,0.5
I saw this and now so can you,0.0,0.0
bisexual,0.0,0.0
This stunning creature wandered into my house for a nap.,0.3818,0.5
Why change the blocks???,-0.3485,0.0
Just picked her up today,0.0,0.0
Untitled artwork by @YU2MARU,0.0,0.0
Who Are Your Top 5 Tits?,-0.0258,0.5
former fundie here to address Robyn’s perpetual “confusion”,0.0,0.0
Saw a lot of people doing edits with other games. This is my take :P,0.4824,0.3125
"It's a janky gopnik shooter, shitposts happen, calm the hell down",-0.5106,0.07222222222222223
I edit all my jihad clips for y'all,0.0,0.0
USA USA USA!!!,0.0,0.0
I think I almost got Trafficked,0.0,0.0
"The McKinney Stables (Cuba, NY)",0.0,0.0
Scored these off OfferUp for $75!,0.0,0.0
Pen holder made at a glass blowing class!,0.0,0.0
XiaoVenti Head Pats by kiamonoii,0.0,0.0
Renegade lynx art,0.0,0.0
[95.7 The Game] Steve Kerr on Steph Curry: “He’s feeling a lot better and he went through all of practice… I think there’s a decent chance he plays tomorrow.” (via @WillardAndDibs),0.7506,0.08888888888888886
The Menards racers were in town last night. It was a great time and they were so nice!,0.8405,0.5166666666666667
Dragon knight [Original],0.0,0.375
Sheesh,0.0,0.0
Have you guys read this one?,0.0,0.0
"Met Giancarlo in Arizona, had him sign my Farcry 6!",0.0,0.0
3 yrs Transitioning- 63yrs.,0.0,0.0
This is the Third time that this guy wants me to suck his leg again.,-0.4404,0.1
Tja,0.0,0.0
Which M3 Are you taking,0.0,0.0
"After months of trying to perfect my main build here it is, my pride and joy. Hope you all enjoy it! RXG-66M-2 ""Spear"" (PC)",0.9459,0.6166666666666667
Daily Vyvan 💞,0.0,0.0
Mummy Miyamura,0.0,0.0
Night time visit from a lost friend,0.2263,0.0
Fingertip in a car door + recovery,0.0,0.0
NSFW: Messages from someone after they SA’d me,0.0,0.0
After first grooming,0.0,0.25
"Sawyer and I in Jackson, WY, 2014.",0.0,0.0
BBC proves that the Israeli army is moving weapons around to show them as 'found' at a specific location,-0.4404,0.15
"O mesmo piá criador do ""gang da Nike"", ele tá de volta",0.0,0.0
This voiceover made the seem even hotter,0.0,0.0
💦,0.0,0.0
How did my iPhone 7 shoot 22 Megapixel?,-0.34,0.0
Marcos tells Chinese Pres. Xi: Filipinos should fish freely in West PH Sea,0.4404,0.2
Do you think these movies could actually work?,0.0,0.0
My old girl OMmy. 14F. Still my besty. She always makes me happy.,0.5719,0.45
They KNEW what they were doing with this design… 😏,0.0,0.0
"Hard at work selling produce, but small nap won’t hurt right?",-0.7003,-0.08531746031746035
People think veganism is a diet,0.0,0.0
Should I smile more often?,0.3612,0.4
Paris Fashion Week : Haute-Couture Fall/Winter 2014-2015,0.0,0.0
What NASA wants to see from SpaceX’s second Starship test flight,0.0,0.1
the closest she’s getting to a proposal this trip,0.0,0.0
Dad confronted after his daughters ran around the neighborhood screaming ,-0.5267,0.0
[Divish; Mariners beat reporter] Mariners are sending RHP Isaiah Campbell to the Red Sox in exchange for IF Luis Urias.,0.0,0.0
Gyat Damn She's To Fine 🤤😌,-0.2263,0.4166666666666667
What manga is this from?,0.0,0.0
Early Summer morning overlooking Lassen Volcanic National Park,0.0,0.1
Why is there no dip?,-0.296,0.0
Christmas has arrived in my home 🎄✨,0.0,0.0
What makes this so good and one of the best in the saga?,0.8377,0.85
"Hydron hard flaming Houston Outlaws streamer Joystick ""I share the same human rights as that guy"" ""Failure of a human"" ""Biggest waste of sperm I've ever seen in my life"" ""I breathe the same air as this fucker""",-0.8666,-0.11547619047619048
It’s officially been a month since we got Scooby! Here are some cute/funny pictures I took of him this past month,0.0,-0.25
Recovery era was something else,0.0,0.0
Forcing caves so far,0.0,0.1
What do you say?,0.0,0.0
This guy honestly doesn’t get enough credit,0.6808,0.3
Taking care of our customer's dog,0.4939,0.0
Something I would like to say ab the post credits scene,0.6124,0.0
my boy🖤✨🤩,0.0,0.0
Such a strange land. ,-0.2023,-0.025
Will it get better? ~ Aseprite - 220x270 pixels,0.4404,0.5
Stopped watching after the first few episodes. Is this character still well?,0.0516,0.024999999999999994
Saying Daddy during sex,0.0,0.0
hej koledzy gra pół życia jest dostępna za darmo do 20 listopada,0.0,0.0
Sydney Melman,0.0,0.0
When they’re the last original members:,0.3182,0.1875
You guys weren't lying about lion's mane,0.4168,0.0
[24PP] Premium Pack 2024 - Sky Striker Ace - Roze Alternate Art,0.0,0.0
Burnt tips,0.0,0.0
My Bayonetta tattoo,0.0,0.0
"What’s something people eat or do that they think is healthy, but is useless?",-0.431,0.0
Yandere mode ON (Ten Ways to Get Dumped by a Tyrant),-0.4019,0.0
"I ain't doom-posting, just following patterns...",0.0,0.0
Does anyone care about the MEN dying in Gaza?,0.4939,0.0
Venom fruit giveaway,0.0,0.0
Enjoying a day at the park,0.5267,0.5
This vexes me...,0.0,0.0
231118 Wendy Instagram Update (feat. Red Velvet),0.0,0.0
Why would Metsudo say this? Doesn't he know they have the NUMBER ONE Kengan Fighter (306 wins BTW) on their side? Is he stupid?,0.5382,-0.24999999999999997
Do it >:3,0.0,0.0
"What will we do without a live stream this weekend? Not sure myself, but here is a optical allusion to cheer you up. If you cant see it squint.",0.6084,-0.05681818181818182
"Diary of a Nice Guy, Part 8",0.4215,0.6
Old meme,0.0,0.1
What's your favorite thing about Rarity?,0.4588,0.5
Taylor Swift fan dies after falling ill during concert in Rio de Janeiro,-0.0772,-0.5
Brown Bikini Photoshoot,0.0,0.0
"He might have bad shooting nights. But he NEVER takes a day off on Defense. We will be nowhere without him. 16 points, 14 rebounds, 3 steals, 5 blocks. Getting Vando back would be huge to reduce his defensive workload. (Reddish is doing a great job filling in)",0.3506,0.12500000000000006
AITAH- Refusing to allow child into daughters wedding.,-0.2023,0.0
