title,sentimentNLTK,sentimentBlob
"Goshikinuma, Fukushima [OC, 6000x4000]",0.0,0.0
Rate my setup,0.0,0.0
Nothing will contain Dave's fury,-0.5719,0.0
meirl,0.0,0.0
hmmm,0.0,0.0
Wel,0.0,0.0
The week before thanksgiving.,0.0,0.0
A story to remember when you're sad.,-0.4767,-0.5
A grape of wrath,0.0,0.0
Dance like no one’s watching.,0.0772,0.0
2meirl4meirl,0.0,0.0
The side of planet Earth we aren't used to seeing (source: Google Earth),0.0,0.0
Works every time,0.0,0.0
This is the moment my daughter met Amazon at the shelter. Watch as they both fall in love. We brought him and his buddy home a few days later.,0.7096,0.09999999999999999
Pizza scam at my hotel,-0.5719,0.0
Of all the dreams one could have,0.4019,0.0
Soon?,0.0,0.0
"TIL In Kenya, a number of cases have been reported in the 2010s of thieves selling transformer oil, stolen from transformers, to the operators of roadside food stalls for use in deep frying. When used for frying, it is reported that transformer oil lasts much longer than regular cooking oil.",-0.7351,0.06666666666666667
He deserved the Oscar back then,0.0,0.0
ITAP of a rainbow in my backyard,0.0,0.0
My little brother took an allergy test and was positive for every one,0.5574,0.019886363636363633
Save the Earth / A Nu Gundam fan-art piece,0.4939,0.0
Is this an Avatar: The Last Airbender Reference lol,0.4215,0.4
Jesus has come,0.0,0.0
Lunch.,0.0,0.0
"Trump Engaged in Insurrection but Can Stay on Colorado’s Ballot Anyway, Court Rules",0.2144,0.0
I’ve seen this raw power only once before!,0.0,-0.11538461538461539
Lionsgate suspends all advertising on Elon Musk’s X,0.0,0.0
Neliel's Previous Artwork (@jessjessdraws),0.0,-0.16666666666666666
Police try not to be useless/evil challenge: IMPOSSIBLE,0.0772,-0.6666666666666666
Found this very old flag in grandfathers chest,0.0,0.13
Just started watching. Ted Danson is freakishly charismatic and wholesome and life is unfair that Jameela Jamil will never be my wife. That is all.,-0.5994,0.0
Korn tattoo done by Devon Nicole at Delirium Tattoo in Pittsburgh,0.0,0.0
Halflife will be completely free to download until November 20th,0.5563,0.2
me_irl,0.0,0.0
"""To protect and to serve"" whenever they feel like it.",0.6249,0.0
"(Unknown Date) China, Tanker trailer transporting Nitric Acid has a leak and explodes when driver tried to seal the leak.",-0.5859,-0.1
[i ate] croque madame,0.0,0.0
Teyvat's Balls tips,0.0,0.0
Don’t ever change Dave. ,0.0,0.0
82 year old woman calls police on caretaker threatening to kill her; police compliment caretaker on firearms & leave. Caretaker kills woman 4 hours later,-0.8658,0.05
We were going to a trip last Sunday with my buddy Jack,0.0,0.0
Kids trying to remember how to make recipes,0.0,0.0
Just found out we don't get paid for Christmas break,0.0,0.0
I sent my mom flowers for her birthday and she got the wrong card,-0.4767,-0.5
Nails,0.0,0.0
The mother ship has landed,0.0,0.0
"[WP] You recently discovered that your father, whom you never knew, is actually a crime-fighter with no free time, and he is unaware that you are his son. In order to talk to him, you become a villain.",-0.5106,-0.05
When a cat chooses you as its favourite person,0.0,0.0
Bob on cancel culture,-0.25,0.0
Exclusive: Apple to pause advertising on X after Musk backs antisemitic post,0.0772,0.0
Insane 3d mural ,-0.4019,-1.0
"Aragorn, you know, that old homeless man",0.0,0.1
.,0.0,0.0
Captain Marvel movies,0.4215,0.0
Be considerate or be blind,0.0516,-0.5
Should try boys.,0.0,0.0
Airplane ready for takeoff!,0.4199,0.25
[Highlight] Harden gets the triple to fall along with the foul with 6 secs left,0.0,0.0
Should taxes be higher?,0.0,0.25
🎃Happy Halloween👻 artwork by Matcha Neko,0.0,0.0
Velveeta with some turkey sausage,0.0,0.0
"Daniel, the raccoon thrower",0.0,0.0
A stranger knocked on my (f23) apartment door at 8:48pm and pulled this yellow object the size of a deck of cards out of her pocket and held it while she waited for an answer.,0.0,0.0
Taylor Swift's Music Banned from Philly Radio Station Before Eagles-Chiefs Game,-0.4588,-0.4
Did that,0.0,0.0
This was dropped off in my kids' sandbox while we were away from the house. Does anyone know what this might be? It looks like a real goat skull wrapped in fabric and beads. WTF?!,0.4857,-0.2125
How do I change the Reddit layout I see?,0.0,0.0
Analogies,0.0,0.0
1940 - New Yorkers walking on a city sidewalk during a snowstorm. ,0.0,0.13636363636363635
Taylor addresses the death of a fan at tonight's Rio concert in her Instagram stories,-0.3818,0.0
“I dated black men”,0.0,-0.16666666666666666
mr sunny jelly chonk is here,0.4215,0.0
Stop the thing we started,-0.296,0.0
Every day is Monday,0.0,0.0
Shoomp! (OC)(5 images),0.0,0.0
Meirl,0.0,0.0
DOBERMAN - Gangsta strike a pose,-0.128,0.0
Did anyone else really struggle during this fight?,-0.6361,0.2
"AITAH for telling my husbands kids (24f 22m) that my house isn't ""their family home"", and its not my fault their mom lost theirs.",-0.0108,0.0
Woman has a guy's friends show up randomly on his vacation for his 40th bday,0.4767,-0.5
Farm cat at my Airbnb wanted all the attention,0.0,0.0
IDF suspends soldier who threw stun grenade into West Bank mosque,0.0,0.0
Gabe Newell on why game delays are okay: 'Late is just for a little while. Suck is forever.',-0.1832,-0.096875
What’s a kinky activity you’ve regretted implementing into your sex life?,-0.3818,0.0
Note to self: Don’t bring a cooling pillow for winter camping ,0.0,0.0
Was making a vitamin drink and reminded me of something,0.296,0.0
Drop your arguments below to make it totally correct and intended,-0.5859,0.0
My pc was asleep I clicked my mouse then this.,0.0,0.0
"Nothing Else Matters played by Ukrainian solider on bandura, Ukrainian national instrument",-0.2755,0.0
And I thought seeing alien with 12 was a childhood trauma...,0.0,-0.25
So this is Eclipse. Every day she leaves the house by herself and takes the bus downtown to the dog park. She even has her own bus pass attached to her collar.,0.0,0.6
Do you like rusty spoons? ,0.3612,0.0
Today's men,0.0,0.0
New update,0.0,0.13636363636363635
"For a moment, She was Glorious! S11E06",0.6696,0.0
My drive to work after a heavy snowfall.,0.0,-0.2
Lad who works in marketing is obviously Scottish. His bosses clearly aren’t..,0.4019,0.05000000000000001
The FTL Virgin vs The Relativistichad,0.0,0.0
Mama relocated all her babies into my sweater drawer (I was not consulted),0.0,0.0
It's over. ,0.0,0.0
"'Dune: Part Two' Moves Up Release Date to March 1, 2024",0.0,0.0
To poop behind an Australian liquor store without being seen,0.0,-0.2
That was insane,-0.4019,-1.0
PSA: You're using the Huo Long Heater wrong,-0.4767,-0.275
Can't argue with that,0.2584,0.0
One of my favourite pictures,0.0,0.0
Pomni find the exit door - Art made by me,0.0,0.0
RAHHHHHHH 🦅🦅🦅🦅🦅🇺🇸🇺🇸🇺🇸🇺🇸🇺🇸🇺🇸,0.0,0.0
wunkus,0.0,0.0
Title,0.0,0.0
"Ukrainian soldier plays ""Nothing else matters"" on ukrainian national instrument Bandura",0.2325,0.0
US Senator casually buying leveraged positions over companies they legislate,0.1779,-0.5000000000000001
This random Chinese phone's peep blocker,0.0,-0.25
Man records as he pulls wounded cop from shootout - Houston TX ,0.4995,0.0
"Apple, Disney and IBM to pause ads on X after antisemitic Elon Musk tweet",0.0,0.0
It’s a convincing argument,0.0516,0.5
Is it worth it?,0.2263,0.3
Baby I Can’t Unsee This,0.0,0.0
LeVar Burton Opens National Book Awards By Shading Extremist Group Moms For Liberty,0.7506,0.0
"Meet “the baby”; my cats only surviving kitten, 1 day old",0.296,0.05
Juard T Rexford’s Debut In-A-Nutshell:,0.0,0.0
Holup. Wait. That's Illegal.,-0.5574,-0.5
Talking dog has big feelings,0.0,0.0
Me_irlgbt,0.0,0.0
woman destroys her date’s motel room after he found out she was trans,-0.5574,0.0
"Destiny reacts to Hasan calling him irresponsible, “this is the guy who watched Arma 3 footage and thought it was real”",-0.4404,0.2
Apple to pause advertising on X after Musk backs antisemitic post,-0.0516,0.0
Bi😚irl,0.0,0.0
This guy's commentary...,0.0,0.0
"Just sitting, and meditating while he waits for his wings",0.0,0.0
How rude,-0.4588,-0.3
Big Delivery in Kherson🍉 - Your donations help directly with the counteroffensive ⚓️ We delivered 6 more boats and 6 powerful motors to the heroes which fight - right in this moment - on the other side of the Dnjepr! Thanks to the r/Ukraine community for your support of our boat fundraiser🙏,0.9073,0.17563775510204077
I made my bed,0.0,0.0
country slander,0.0,0.0
LEGO Mario Jumping Machine,0.0,0.0
Is this a wasp?,0.0,0.0
Shut Up And Stay In The Truck.,0.0,0.0
"Meet Luna!! She beat parvo as a pup, and is now healthy and super happy. She likes to sit on the couch like a human 😂",0.9449,0.4083333333333333
Midsommar ,0.0,0.0
"I've played many times, and still this conversation always kills me.",-0.2732,0.5
What are you doing?,0.0,0.0
Idea: Let us continuously fall down platforms by holding the down button,0.0,-0.15555555555555559
My impression of media coverage of the 2024 POTUS race...,0.2263,0.0
The time I was mom-shamed...and I don't have kids,0.0,0.0
The new Scott Pilgrim anime has Gideon with the Kiryu drip.,0.0,0.13636363636363635
Title,0.0,0.0
ai911,0.0,0.0
Watch my voids tail puff up as he realises I pet another cat on the way home ,0.0,0.0
"World war 1 veterans; Shell shock sequels and war neurosis,1918. Colourised and upscaled footage. ",-0.886,0.0
day 11 of drawing a zac oyama until he posts another youtube short,0.0,0.0
"Nov 17: 50 years ago, Nixon under investigation declared, ‘I’m not a crook’",0.0,0.0
New villain origin-story just dropped,-0.5574,0.13636363636363635
WHAT THE FUCK IS THIS?!?!,-0.6645,-0.625
I guess that works too,0.0,0.0
"""SSsssssSSsssssSSs pow""",0.0,0.0
"Sparky, please respect my privacy I'm begging you",0.6597,0.0
A tooth that I grew in my abdomen,0.0,0.0
I’m still trippin bro,0.0,0.0
"The importance of applying sunblock, a visible-light/UV-light comparison",0.3612,0.0
What do you guys think of my living orb?,0.0,0.0
So excited to replay Mario RPG in 3D!,0.4561,0.46875
How I got a job working with autistic kids,0.0,-0.2
I wonder how many takes Jim took for this. Anyone else notice this? xd,0.6705,0.5
"TIL the first tests for Kevlar in bulletproof vests was done on goats. After 24 hours, one died. The rest had non-life threatening wounds.",-0.7906,0.25
The Rock is the biggest and fakest celebrity and a corporate shill.,0.0,0.0
So we can all agree the anime versions are stronger and that's what we'll use to scale them from now on?,0.6249,0.0
So romantic,0.4576,0.0
Jack Herer joint and a nice rainy day,0.3612,0.6
Iman Vellani on ‘The Marvels’ box office performance,0.0,0.0
Sam Altman fired as CEO of Open AI,-0.5574,0.0
Thank you to all the brave firefighters,0.7096,0.8
"Those tentacles around his head were cool, still think they should have been in the redesign.",0.3182,0.35
People can't access their AI girlfriend because the service went down after CEO jailed for setting his apartment on fire,-0.6808,-0.15555555555555559
I think my mask is beautiful,0.5994,0.85
"Nicole Millers, We're not expecting any Nicole Millers, in fact we have too many as it is.",0.0,0.5
im actually about to lose it i stg,-0.4019,0.0
Genital herpes linked to accelerated brain shrinkage,0.0,0.0
AITA for punishing my 16-year-old step-daughter after we found out she was bullying a kid for being poor,-0.891,-0.4
🔥Tomistoma schlegelii scratching itself,0.0,0.0
Nurse raped during home visit by elderly patient's son,-0.6808,0.0
anime_irl,0.0,0.0
Scientists,0.0,0.0
These kids are getting new Iphones in Elementary school 🥴,0.0,0.21818181818181817
"All of a sudden, The Marvels became the greatest superhero movie of all time",0.802,0.5
About 6 months ago I posted about having a horrific allergic reaction that lead to being forced to shave my head. Here's my update.,-0.8625,-0.65
LPT: Never pay for Adobe's cancellation fee,0.0762,0.0
Picked up my rental car to see this.,0.0,0.0
The talking magpies.,0.0,0.0
"Connor Stalions Tustin CA mortgage paid off 4 days prior to ""Uncle T's"" message board post bragging about Michigan gaining a competitive advantage",0.6705,0.0
maybe maybe maybe,0.0,0.0
Trump Gives Away the Game With January 6 Confession in New Recording: A new audio recording reveals Trump admitting that he could have stopped the January 6 “problem” all on his own.,-0.2263,0.11818181818181817
"This is the most gorgeous lion, I have ever seen",0.6478,0.6
YSK: Cancer Can Be an Invisible Illness,-0.7964,0.0
Jakob Silfverberg scores to tie the game but the refs somehow determine the puck DID not cross the line and it's no goal.,-0.4215,-0.2
Woman attempts to use “generational trauma towards white men” to get out of a DUI,-0.4215,0.0
"While most snail eyes generally only detect light, the eyes of the conch snail have complex retinas and can actually produce an image. In other words, they see you.",0.0,0.07916666666666668
I don’t even want to know how they came up with this…,0.0772,0.0
I got trampled today,0.0,0.0
The old Cherry Coke look.,0.0,0.1
The fact that they zoomed right past Kaitlin absolutely killed me,-0.6997,-0.05476190476190477
Supposedly Black Friday deals?,0.0,-0.16666666666666666
"Teamsters President Sean O’brien went on Fox News and once again humiliated Republican Sen. Mullin, who tried to fight him in a Senate hearing this week. “So make up your mind. You want to date me, fight me, bite me, or shoot me?”",-0.8271,0.0
"The Last of Us Part II Remastered coming to PS5 on January 19, 2024",0.0,0.0
Erm ackchyually,0.0,0.0
Its here,0.0,0.0
[AK-Bites] Your Name,0.0,0.0
Leaked audio of ADL chief exec Jonathan Greenblatt panicking because young people aren’t buying Israel’s bullshit,-0.8402,0.1
Old lady Molly crossed the Rainbow Bridge at 16,0.0,0.1
Knights of the Old Republic remake is reportedly dead,-0.6486,-0.05
I just had to see how the new First Shadow image would look as a poster.,0.0,0.19318181818181818
Major ROH Spoilers,0.0,0.0625
Hats off to that man for not hitting him back,0.0,0.0
Our narrowboat☺️ moved on recently!,0.0,0.0
“Car guy” on social media starter pack,0.0,0.03333333333333333
Scorch mating ritual,0.0,0.0
Uh oh,0.0,0.0
"My battletag was manually set to 'Wifeleaver' by a Game Master. It was then flagged as being 'inappropriate' *twice*. Then a Game Master manually set it back to 'Wifeleaver' *again*. Is it inappropriate or not, Blizzard?",0.0,-0.26666666666666666
Very fast and smooth leaps.,0.0,0.33
Taylor Swift confirms that a fan lost their life before her show in Brazil 💔,0.2023,0.0
Uh oh,0.0,0.0
Found on r memes,0.0,0.0
There is some poor guy out there who was placed in a coma in 2019 and will be in for one hell of a ride when they wake up.,-0.8271,-0.25
Huge Fish Caught From Dnipro River ,0.3182,0.4000000000000001
new formula,0.0,0.13636363636363635
That Was A Dick Move,-0.5106,0.0
"I'm a photographer and I captured these two, who are friends in my neighborhood in SWFL. Not my cat, not my raccoon.",0.4767,0.0
Hypocrisy,0.0,0.0
Standing under Starship’s 33 engines,0.0,0.0
So many questions...,0.0,0.5
Now you can them with UPI – welcome to the digital era in India,0.4588,0.4
She has chosen darkness.,-0.25,0.0
To hell with these leaflovers!,-0.7088,0.0
A man of principle,0.0,0.0
Before & After Breakfast,0.0,0.0
Crazy Base Jump,-0.34,-0.7
World of Warcraft respond to Snoop Dogg giving up “smoke”,0.34,0.0
What a nice try,0.4215,0.6
"Ukrainian soldier plays ""Nothing else matters"" on Ukrainian national instrument Bandura",0.2325,0.0
Had a dream where toddlermaxxing was a trend more context in the comments,0.25,0.5
Say hello to Lord Vader,0.0,0.0
Very true though,0.4754,0.45499999999999996
Average conversation between an austrian an a gayman,0.0,-0.15
Full Flesheater court reveal. Behold the most noble court and their glorious king!,0.831,0.5333333333333333
I saw it and now I can't unsee it,0.0,0.0
You Are Not Ruley,0.0,0.0
Seriously! How good is Antony Starr,0.3595,0.14166666666666666
free entry for cunnysseurs😭,0.5106,0.4
Tom Aspinall with a high risk question 😅🙃,-0.2732,0.16
OP’s roommate just created fluorine gas inside a house.,0.25,0.0
Wildest prediction I’ve ever seen in cricket. This is from ex NZ Coach Mike Hesson right before the IND vs NZ semifinal.!!,0.0,0.4464285714285714
It’s giving vampire Christmas 🧛‍♀️🎄 newest set done by me,0.34,0.0
Jesus H Christ.,0.0,0.0
Left the office & found the neighbors cat in my car.,0.0,0.0
Help!! My roommate’s plate and I broke it!! 😭,-0.3111,0.0
Dog who survived 72 days in mountains after owner's death is regaining weight and back on hiking trails | AP News,-0.1531,0.0
"World Cup winning captains so far, Who do you think will join this elite list?",0.6808,0.3
Daniel,0.0,0.0
BREAKING: Bengals QB Joe Burrow is done for the season with his wrist injury.,-0.4215,0.0
"Petah, what does this mean?",0.0,-0.3125
A Tortured Soul,-0.5574,0.0
‘VULTURES’ uncensored via Andrew Barber,0.0,0.0
title,0.0,0.0
Wow I love Shigeru Miyamoto!,0.8516,0.3625
The walk!!!!,0.0,0.0
"""At last i can afford my own place""",0.0,0.3
Release the PoLiTiCaL PrIsOnErS.. they were set up by Pigs!,0.0,0.0
Hottake but I don’t think that being a main of a champ means that you know how to balance said champ,0.8519,0.16666666666666666
ITAP of the Washington mountains from the sky,0.0,0.0
300 HP Two Stage Rotary Compressor,0.0,0.0
"“Crawling in my skin, these wounds they will not heal”",0.0,0.0
"Night Lords Killteam, Nemesis Claw!!!",0.0,0.0
91-Year-Old Grandma Guesses Pokemon Names,0.0,0.0
The Tier List no one has made before,-0.296,0.0
Rejoice! Naughty Dog confirms existing owners of the PS4 can upgrade to a digital version for $10!,0.5399,-0.07500000000000001
Me_irl,0.0,0.0
Orange kitty cookies I made followed by the inspiration : ),0.5267,0.5
We’re playing video games together. I’m glad Sid’s comfy.,0.5859,0.5
Luffy marking Laboon and Fishman Island is a genius move,0.0,0.0
Just got access to a Bloomberg Terminal. Calls/Puts on GME 👇,0.0,0.0
Alicent behind the scene,0.0,-0.4
The Black Parade Blimp,0.0,-0.20833333333333331
"Update on the abandoned chevy i bought, a thorough wash did wonders for it. Im almost wondering if the lichen on it preserved the paint",-0.4588,0.0
The hardest part of my Loader 4 no OS tuning run so far: Nightfall Raven,-0.296,0.1
Church leader shot in the head while preaching at Glendale street corner,0.0,0.0
Still not as bad as Zutara,0.431,-0.6999999999999998
Day one at the Sol Foundation symposium,0.0,0.0
The ant's story!,0.0,0.0
I lost my boy Oscar (16) today,-0.3182,0.0
Bet he won’t step out his truck again lol,0.4215,0.8
When Julia Stiles became a black girl,0.0,-0.16666666666666666
Found this while browsing through YT Shorts,0.0,0.0
They all knew,0.0,0.0
Which Sniper wins in a fight?,0.2732,0.3
[Wojnarowski] The NBA is requiring LaMelo Ball to cover a tattoo below his left ear that the league insists violates rules against exposing commercial logos on players’ bodies – a policy that sources close to Ball contend has been infrequently enforced.,-0.6369,0.0
did you guys know that wade was in the spongebob movie,0.0,0.0
Li Mei performs the most brutal brutality on Shao,-0.8648,-0.1875
"Nicht laminiert, aber hoffentlich bestuhlt",0.0,0.0
Is this really what FFXIV dungeons are like?,0.3612,0.2
I'm honestly surprised that Trailblazer is a canon 'hot girl' in this game.,0.5994,-0.01666666666666668
egg🎉😧irl,0.0,0.0
‘Merica!!!,0.0,0.0
One year later our sweet Ruby is thriving,0.4588,0.175
From the awesome The Eras Tour: 1989 era,0.6249,1.0
Do guys actually like “crazy” girls?,0.3612,-0.3
Assault Squads!,-0.6239,0.0
Now this is a win,0.5859,0.8
"After the 2V8, Prop Hunt will come to the DBD Mobile! What are your thoughts?",0.0,0.0
Greatest Comedian of our Time,0.7783,1.0
Can we have our babies back now?,0.0,0.0
Vouchers are dead. House just voted to strip it from HB1.,-0.6486,-0.2
Some kid sent this out of nowhere,0.0,0.0
Na sermon yata ang bata.,0.0,-0.225
I’m grateful for being able to do the bare minimum to survive and mask successfully most of the time. But I’m tired of it consuming all my energy.,0.2263,0.1625
The Divine Towers form an almost perfect hexagon around... something?,0.791,1.0
New Orikan!,0.0,0.17045454545454544
At my biggest in 2020 vs. today. I cannot believe I let myself get to that point,0.0,0.0
Gf found snake in box [New Jersey],0.0,0.13636363636363635
What was he thinking,0.0,0.0
YouTube Ads Are Getting Continuously Worse,-0.4767,-0.4
Smoking doesn't make you look cool,0.3182,0.35
Unearthed this collection from my mom’s garage! Bwahhh!,0.0,0.0
Bro made a Oscar winner movie in the comments.,0.5859,0.0
More testicles means more iron,0.0,0.5
He must really love his dog,0.6697,0.5
Biggest Glow Up in Season 2,0.0,0.0
Rollie speaking on Shakur aged like wine 🍷,0.3612,-0.1
"Finally, after all these years...",0.0,0.0
Today’s question is: what’s your favorite UNSC assault rifle!,-0.2714,0.625
to steal a canopy on the beach,-0.4939,0.0
"Subtle Diversity - Skintone edits! (pt. 1, 2, 3, 4) (hoyo pls stop using the same exact color smh)",-0.2942,-0.055555555555555546
When your laugh gets you $25,0.5574,0.3
A sorte não é para todos,0.0,0.0
One armed characters that have a weapon instead of a hand,0.25,0.0
"Oh hey, y'all are amazing :›",0.5859,0.6000000000000001
If you want to show car brains how it feels to ride in the bike lane in many places of the world,0.0772,0.5
Up close encounter with a Sperm Whale,0.0,0.0
I’ve never used it because I don’t know what it is,0.0,0.0
From twitter. Not finished,0.0,0.0
Who the fuck is this,-0.5423,-0.4
Beautiful Binx,0.5994,0.85
KANKAN'S BACK BABY!!!,0.0,0.0
ITS UNDER THE SAU-,0.0,0.0
What is this flag on the ceiling?,0.0,0.0
"X is placing ads for Amazon, NBA Mexico, NBCUniversal, and others next to content with white nationalist hashtags",0.1779,0.0
Annoying coworker who thinks I'm HER assistant can take ALL my calls,-0.4019,-0.8
So.... many..,0.0,0.5
"This is my boyfriend’s turtle. He’s had him since a baby and this guy’s now 22. He was told he was a Blanding’s turtle, but never knew for certain. Thoughts?",-0.3007,0.21428571428571427
My sister in law just found a giant pencil cactus for $75 and I am at a loss for words,-0.3182,0.0
Lost my gaming rights with my nephew yesterday,-0.3182,0.0
A drummer from a concert that I shot today,0.0,0.0
[OC] Runic Dice Blue Smoke Resin Dice Set And Box Giveaway (Mods Approved),0.0,0.0
"THE KING!!! Just Appreciate greatness man. This man is doing the unthinkable at his age. Running out of adjectives to describe him. 35 points, 5 rebounds, 9 assists, 2 steals. Carrying us night in night out!!",-0.4153,-0.078125
Iofi..,0.0,0.0
I’ve heard of discrepancies between dye lots but this is ridiculous,-0.5023,-0.3333333333333333
Found this snake in Honduras (near Copan) What is the reason of this pattern? Is it unusual?,0.0,0.15000000000000002
Weirdly worded kids'hoodie. Took me a few tries to figure it out,-0.296,-0.26666666666666666
I've lost count of all the subs I've had to mute,-0.3182,0.0
"Girl With a Pearl Hoop, my painting that gets the most hate",-0.6115,-0.15000000000000002
What to do about garbage not being picked up in some districts?,0.0,0.0
Ich_iel,0.0,0.0
"[Homemade] Smoked Trout Mousse, English Pea and Edamame Pesto, Quick Pickle, Trout Skin Bacon, Hollandaise",0.0,0.16666666666666666
"SWAT team rescue two hostages in Queen Anne, Seattle",0.5106,0.0
Short sad story,-0.4767,-0.25
Found this at my uncles house,0.0,0.0
[OC] Idiot passes over carpool double yellow... and then back right in front of LAPD motor.,-0.5106,-0.10285714285714287
When did Subway get so expensive?!?! This used to be the affordable option!,0.0,-0.9765625
Gold Nail,0.0,0.0
lol,0.4215,0.8
"To keep the runtime of The Batman (2022) under 5 hours, the Riddler was not allowed to hide any trophies in Gotham",0.1326,0.0
Hit and run in Tustin,0.0,0.0
🤮 MAP communities everywhere 🤮,0.0,0.0
On a rap,0.0,0.0
Half Life 1 gets proper Steam Deck Verified support!,0.4574,-0.08333333333333333
"I mean, they're not wrong doe",0.3724,-0.03125
Black walnut update,0.0,-0.16666666666666666
"[Post Game Thread] Long Beach State defeats Michigan, 94-86",-0.3182,-0.225
Cool picture of the Guardians Tower,0.3182,0.35
The Queen of Beauty,0.5859,0.0
How can these guys get Blu-ray prints before it's even released on Blu-ray?,0.0,0.0
corporate charity begging is getting out of control,0.4215,0.0
Her truth is still marching on: The United States in 2123 AD,0.6249,0.0
I liked this one,0.4215,0.6
Kennedy playing video games,0.2023,0.0
Reverse: 1999 Version 1.5 New Characters & Garments,0.0,0.13636363636363635
Little orb design I put together in about 10 minutes,0.0,-0.1875
Nemesis claw Nightlords kill team,-0.6908,0.0
Girls fight in Drake concert over a sign,-0.3818,0.0
[Request] How much time would it take to have this much attempts ?,0.0,0.2
Fishing like a real man,0.3612,0.2
Wholesum ho jao ,0.0,0.0
New item! Kirkland Signature Breakfast Sandwiches. $15.99 (1748763),0.0,0.17045454545454544
"Lorillard's Chewing Tobacco, 1893",0.0,0.0
“I have no tits”,-0.296,0.0
Cursed Age,0.0,0.0
Uh oh sheepdogs,0.0,0.0
What would you have done?,0.0,0.0
Fuck your haircut,-0.5423,-0.4
Just want to drop this here. (remove if this breaks any rules),-0.2023,0.0
Insane 3d mural,-0.4019,-1.0
😂😂😂,0.0,0.0
Did you notice this reference in the Epilogue?,0.0,0.0
No Prizes for the correct answer,0.2023,0.0
One year without cutting the lawn,0.0951,-0.6
Didn’t know MJ and Peter had Poses and Expressions…,0.0,0.0
Temporarily satisfied…,0.0,0.0
It's cool how F1 travels worldwide to so many iconic and recognizable cities,0.3182,0.4
Nice daily dose of bug protein ,0.4215,0.3
gay🍌irl,0.0,0.0
